14:35:26.220875 IP 192.168.1.202.25999 > 192.168.1.1.53: 1383+ A? cognito-identity.us-east-2.amazonaws.com. (58)
14:35:26.239805 IP 192.168.1.202.52973 > 192.168.1.1.53: 12908+ A? lcs-dev-cdn.s3.us-east-2.amazonaws.com. (56)
14:35:26.387315 IP 192.168.1.202.24708 > 192.168.1.1.53: 56223+ A? prd.us-east-1.telemetryservice.brightspace.com. (64)
14:35:27.389566 IP 192.168.1.202.60512 > 192.168.1.1.53: 47887+ A? kinesis.us-east-2.amazonaws.com. (49)
14:35:29.757488 IP 192.168.1.202.42515 > 192.168.1.1.53: 11930+ A? prod.ally.ac. (30)
14:35:33.270411 IP 192.168.1.202.45144 > 192.168.1.1.53: 37593+ A? d2l-docbuilder-prod-us-east-1-converted.s3.amazonaws.com. (74)
14:35:48.004994 IP 192.168.1.202.64384 > 192.168.1.1.53: 18547+ A? vortex.data.microsoft.com. (43)
14:35:58.102435 IP 192.168.1.202.62919 > 192.168.1.1.53: 9735+ A? femetrics.grammarly.io. (40)
14:36:04.291290 IP 192.168.1.202.60866 > 192.168.1.1.53: 36563+ A? treatment.grammarly.com. (41)
14:36:08.837706 IP 192.168.1.202.52993 > 192.168.1.1.53: 40154+ A? glb-db52c2cf8be544.github.com. (47)
14:36:11.163765 IP 192.168.1.202.55834 > 192.168.1.1.53: 40488+ A? mobile.events.data.trafficmanager.net. (55)
14:36:15.772295 IP 192.168.1.202.62647 > 192.168.1.1.53: 64805+ A? fmfmobile.fe.apple-dns.net. (44)
14:36:17.751876 IP 192.168.1.202.53702 > 192.168.1.1.53: 54154+ A? f-log-mac-extension.grammarly.io. (50)
14:36:22.106468 IP 192.168.1.202.62549 > 192.168.1.1.53: 35837+ A? asimov.vortex.data.trafficmanager.net. (55)
14:37:04.403797 IP 192.168.1.202.56595 > 192.168.1.1.53: 22683+ A? femetrics.grammarly.io. (40)
14:37:11.699090 IP 192.168.1.202.53044 > 192.168.1.1.53: 49996+ A? global.in.ai.monitor.azure.com. (48)
14:37:33.362444 IP 192.168.1.202.51891 > 192.168.1.1.53: 32105+ A? asimov.vortex.data.trafficmanager.net. (55)
14:37:42.485546 IP 192.168.1.202.60107 > 192.168.1.1.53: 929+ A? gateway.fe.apple-dns.net. (42)
14:37:42.606991 IP 192.168.1.202.63293 > 192.168.1.1.53: 27264+ A? stocks-data-service.lb-apple.com.akadns.net. (61)
14:37:48.819357 IP 192.168.1.202.57667 > 192.168.1.1.53: 18074+ A? vortex.data.microsoft.com. (43)
14:37:53.856739 IP 192.168.1.202.60489 > 192.168.1.1.53: 42249+ A? global.in.ai.monitor.azure.com. (48)
14:38:13.623688 IP 192.168.1.202.57336 > 192.168.1.1.53: 63300+ A? update.code.visualstudio.com. (46)
14:38:15.038263 IP 192.168.1.202.44290 > 192.168.1.1.53: 8263+ A? marketplace.visualstudio.com. (46)
14:38:15.558689 IP 192.168.1.202.58326 > 192.168.1.1.53: 52181+ A? glb-db52c2cf8be544.github.com. (47)
14:38:17.818270 IP 192.168.1.202.61249 > 192.168.1.1.53: 60610+ A? mobile.events.data.microsoft.com. (50)
14:38:25.929662 IP 192.168.1.202.57365 > 192.168.1.1.53: 6819+ A? vortex.data.microsoft.com. (43)
14:38:28.432998 IP 192.168.1.202.58938 > 192.168.1.1.53: 48337+ A? eus015-breeziest-in.cloudapp.net. (50)
14:38:30.771078 IP 192.168.1.202.54038 > 192.168.1.1.53: 8376+ A? e-0014.e-msedge.net. (37)
14:38:31.951557 IP 192.168.1.202.50287 > 192.168.1.1.53: 1373+ A? deault-exp-tas-com.e-0014.e-msedge.net. (56)
14:38:34.038699 IP 192.168.1.202.62864 > 192.168.1.1.53: 45869+ A? onedscolprdcus03.centralus.cloudapp.azure.com. (63)
14:39:17.429699 IP 192.168.1.202.31430 > 192.168.1.1.53: 9360+ A? safebrowsing.googleapis.com. (45)
14:39:26.160131 IP 192.168.1.202.57146 > 192.168.1.1.53: 22760+ A? capi.grammarly.com. (36)
14:39:37.993847 IP 192.168.1.202.61288 > 192.168.1.1.53: 2000+ A? gnar.grammarly.com. (36)
14:40:04.381656 IP 192.168.1.202.50771 > 192.168.1.1.53: 21793+ A? femetrics.grammarly.io. (40)
14:40:04.637119 IP 192.168.1.202.8376 > 192.168.1.1.53: 1580+ A? femetrics.grammarly.io. (40)
14:40:07.811902 IP 192.168.1.202.64959 > 192.168.1.1.53: 38137+ A? vweixinthumb.tc.qq.com. (40)
14:40:32.628349 IP 192.168.1.202.63125 > 192.168.1.1.53: 15144+ A? deault-exp-tas-com.e-0014.e-msedge.net. (56)
14:40:54.272281 IP 192.168.1.202.60980 > 192.168.1.1.53: 6604+ A? gateway.fe.apple-dns.net. (42)
14:41:29.367870 IP 192.168.1.202.19701 > 192.168.1.1.53: 35554+ A? d27xxe7juh1us6.cloudfront.net. (47)
14:41:47.748555 IP 192.168.1.202.10237 > 192.168.1.1.53: 36092+ A? marketplace.visualstudio.com. (46)
14:42:07.703217 IP 192.168.1.202.50937 > 192.168.1.1.53: 7633+ A? dns.weixin.qq.com.cn. (38)
14:43:05.773885 IP 192.168.1.202.53106 > 192.168.1.1.53: 49807+ A? default.exp-tas.com. (37)
14:43:06.050965 IP 192.168.1.202.58457 > 192.168.1.1.53: 15955+ A? dc.services.visualstudio.com. (46)
14:43:09.917844 IP 192.168.1.202.52090 > 192.168.1.1.53: 9604+ A? glb-db52c2cf8be544.github.com. (47)
14:43:10.287540 IP 192.168.1.202.65456 > 192.168.1.1.53: 22669+ A? femetrics.grammarly.io. (40)
14:43:10.511820 IP 192.168.1.202.62553 > 192.168.1.1.53: 1908+ A? update.code.visualstudio.com. (46)
14:43:12.235751 IP 192.168.1.202.63820 > 192.168.1.1.53: 61307+ A? mobile.events.data.microsoft.com. (50)
14:43:20.993073 IP 192.168.1.202.51404 > 192.168.1.1.53: 33405+ A? vortex.data.microsoft.com. (43)
14:43:25.030588 IP 192.168.1.202.50003 > 192.168.1.1.53: 10217+ A? play.google.com. (33)
14:43:56.484344 IP 192.168.1.202.64614 > 192.168.1.1.53: 6518+ A? clientservices.googleapis.com. (47)
14:44:46.673113 IP 192.168.1.202.62870 > 192.168.1.1.53: 28430+ A? proxy.safebrowsing.apple. (42)
14:45:10.222697 IP 192.168.1.202.51837 > 192.168.1.1.53: 31952+ A? femetrics.grammarly.io. (40)
14:45:43.550035 IP 192.168.1.202.47166 > 192.168.1.1.53: 38442+ A? treatment.grammarly.com. (41)
14:45:55.022495 IP 192.168.1.202.59810 > 192.168.1.1.53: 58106+ A? gateway.fe.apple-dns.net. (42)
14:45:55.066376 IP 192.168.1.202.57995 > 192.168.1.1.53: 59533+ A? stocks-data-service.lb-apple.com.akadns.net. (61)
14:45:55.084162 IP 192.168.1.202.58161 > 192.168.1.1.53: 25821+ A? a1091.dscw154.akamai.net. (42)
14:46:04.290329 IP 192.168.1.202.56507 > 192.168.1.1.53: 16403+ A? treatment.grammarly.com. (41)
14:46:29.371113 IP 192.168.1.202.45537 > 192.168.1.1.53: 51130+ A? d27xxe7juh1us6.cloudfront.net. (47)
14:47:10.180314 IP 192.168.1.202.61691 > 192.168.1.1.53: 8626+ A? femetrics.grammarly.io. (40)
14:48:04.650915 IP 192.168.1.202.10285 > 192.168.1.1.53: 32669+ A? edgeapi.slack.com. (35)
14:48:04.651199 IP 192.168.1.202.13390 > 192.168.1.1.53: 35807+ A? probproofs.slack.com. (38)
14:48:05.211077 IP 192.168.1.202.50348 > 192.168.1.1.53: 41811+ A? optimizationguide-pa.googleapis.com. (53)
14:48:40.405796 IP 192.168.1.202.56082 > 192.168.1.1.53: 33215+ A? brightspace.nyu.edu. (37)
14:48:50.451893 IP 192.168.1.202.1290 > 192.168.1.1.53: 34227+ A? app.slack.com. (31)
14:49:10.280789 IP 192.168.1.202.64499 > 192.168.1.1.53: 7474+ A? femetrics.grammarly.io. (40)
14:50:49.188914 IP 192.168.1.202.58262 > 192.168.1.1.53: 55913+ A? my.1password.com. (34)
14:50:49.427763 IP 192.168.1.202.55406 > 192.168.1.1.53: 11460+ A? b5n.1password.com. (35)
14:50:50.303054 IP 192.168.1.202.49653 > 192.168.1.1.53: 60166+ A? gateway.fe.apple-dns.net. (42)
14:50:51.704350 IP 192.168.1.202.64681 > 192.168.1.1.53: 53380+ A? cache.agilebits.com. (37)
14:51:10.279357 IP 192.168.1.202.64855 > 192.168.1.1.53: 55487+ A? femetrics.grammarly.io. (40)
14:51:29.383564 IP 192.168.1.202.34686 > 192.168.1.1.53: 63148+ A? d27xxe7juh1us6.cloudfront.net. (47)
14:51:35.084661 IP 192.168.1.202.22525 > 192.168.1.1.53: 20171+ A? www.google.com. (32)
14:51:38.209024 IP 192.168.1.202.21206 > 192.168.1.1.53: 22163+ A? optimizationguide-pa.googleapis.com. (53)
14:51:38.373209 IP 192.168.1.202.42399 > 192.168.1.1.53: 10157+ A? static.metafi.codefi.network. (46)
14:51:38.989445 IP 192.168.1.202.1797 > 192.168.1.1.53: 24625+ A? lh3.googleusercontent.com. (43)
14:51:39.036994 IP 192.168.1.202.9366 > 192.168.1.1.53: 19204+ A? safebrowsing.googleapis.com. (45)
14:51:39.052204 IP 192.168.1.202.28685 > 192.168.1.1.53: 56950+ A? play.google.com. (33)
14:51:39.284927 IP 192.168.1.202.27824 > 192.168.1.1.53: 999+ A? adservice.google.com. (38)
14:51:41.352403 IP 192.168.1.202.55629 > 192.168.1.1.53: 34512+ A? stackoverflow.com. (35)
14:51:41.868557 IP 192.168.1.202.13328 > 192.168.1.1.53: 15972+ A? i.stack.imgur.com. (35)
14:51:41.868732 IP 192.168.1.202.60792 > 192.168.1.1.53: 5648+ A? www.gravatar.com. (34)
14:51:41.870829 IP 192.168.1.202.46382 > 192.168.1.1.53: 62449+ A? lh4.googleusercontent.com. (43)
14:51:41.871750 IP 192.168.1.202.51042 > 192.168.1.1.53: 25049+ A? www.googletagmanager.com. (42)
14:51:42.063106 IP 192.168.1.202.40994 > 192.168.1.1.53: 20342+ A? securepubads.g.doubleclick.net. (48)
14:51:42.087937 IP 192.168.1.202.7489 > 192.168.1.1.53: 33259+ A? qa.sockets.stackexchange.com. (46)
14:51:42.099673 IP 192.168.1.202.6452 > 192.168.1.1.53: 18047+ A? www.google-analytics.com. (42)
14:51:42.333059 IP 192.168.1.202.16850 > 192.168.1.1.53: 25407+ A? clc.stackoverflow.com. (39)
14:51:42.341968 IP 192.168.1.202.28607 > 192.168.1.1.53: 16354+ A? www.googletagservices.com. (43)
14:51:42.354437 IP 192.168.1.202.48021 > 192.168.1.1.53: 52702+ A? rtb0.doubleverify.com. (39)
14:51:42.358493 IP 192.168.1.202.59189 > 192.168.1.1.53: 1560+ A? stats.g.doubleclick.net. (41)
14:51:42.518058 IP 192.168.1.202.43271 > 192.168.1.1.53: 61491+ A? pr.ybp.yahoo.com. (34)
14:51:42.837097 IP 192.168.1.202.11584 > 192.168.1.1.53: 59631+ A? rtbc-ue1.doubleverify.com. (43)
14:51:42.837496 IP 192.168.1.202.16168 > 192.168.1.1.53: 13384+ A? ad.doubleclick.net. (36)
14:51:42.843936 IP 192.168.1.202.4358 > 192.168.1.1.53: 59929+ A? www.googleapis.com. (36)
14:51:42.890789 IP 192.168.1.202.36535 > 192.168.1.1.53: 28276+ A? fw.adsafeprotected.com. (40)
14:51:42.969191 IP 192.168.1.202.13858 > 192.168.1.1.53: 3874+ A? cdn.doubleverify.com. (38)
14:51:42.971482 IP 192.168.1.202.21347 > 192.168.1.1.53: 32087+ A? googleads4.g.doubleclick.net. (46)
14:51:42.972141 IP 192.168.1.202.32667 > 192.168.1.1.53: 29408+ A? sync.mathtag.com. (34)
14:51:42.996164 IP 192.168.1.202.45238 > 192.168.1.1.53: 22450+ A? c.evidon.com. (30)
14:51:43.009714 IP 192.168.1.202.19578 > 192.168.1.1.53: 35475+ A? fonts.gstatic.com. (35)
14:51:43.034986 IP 192.168.1.202.40969 > 192.168.1.1.53: 29749+ A? dt.adsafeprotected.com. (40)
14:51:43.080544 IP 192.168.1.202.16278 > 192.168.1.1.53: 7242+ A? tps.doubleverify.com. (38)
14:51:43.087937 IP 192.168.1.202.13902 > 192.168.1.1.53: 44263+ A? dpm.demdex.net. (32)
14:51:43.164026 IP 192.168.1.202.23759 > 192.168.1.1.53: 46105+ A? pagead2.googlesyndication.com. (47)
14:51:43.174814 IP 192.168.1.202.11655 > 192.168.1.1.53: 44654+ A? analyticspixel.microsoft.com. (46)
14:51:43.202686 IP 192.168.1.202.59878 > 192.168.1.1.53: 12403+ A? tpsc-ue1.doubleverify.com. (43)
14:51:43.287737 IP 192.168.1.202.4489 > 192.168.1.1.53: 65182+ A? l.betrad.com. (30)
14:51:43.364962 IP 192.168.1.202.8223 > 192.168.1.1.53: 45682+ A? tpc.googlesyndication.com. (43)
14:51:44.221220 IP 192.168.1.202.62864 > 192.168.1.1.53: 62336+ A? beap-bc.yahoo.com. (35)
14:51:49.357030 IP 192.168.1.202.53597 > 192.168.1.1.53: 59402+ A? clients4.google.com. (37)
14:51:54.452863 IP 192.168.1.202.62740 > 192.168.1.1.53: 1996+ A? ade.googlesyndication.com. (43)
14:53:03.378756 IP 192.168.1.202.12930 > 192.168.1.1.53: 33006+ A? play.google.com. (33)
14:53:10.259688 IP 192.168.1.202.56067 > 192.168.1.1.53: 43130+ A? femetrics.grammarly.io. (40)
14:53:39.866582 IP 192.168.1.202.54655 > 192.168.1.1.53: 50923+ A? mask-api.icloud.com. (37)
14:53:39.981310 IP 192.168.1.202.55878 > 192.168.1.1.53: 48327+ A? configuration.ls.apple.com. (44)
14:53:40.017740 IP 192.168.1.202.61418 > 192.168.1.1.53: 63559+ A? gateway.fe.apple-dns.net. (42)
14:53:40.054621 IP 192.168.1.202.59775 > 192.168.1.1.53: 53437+ A? stocks-data-service.lb-apple.com.akadns.net. (61)
14:53:40.054798 IP 192.168.1.202.64953 > 192.168.1.1.53: 33622+ A? stocks-sparkline-lb.apple.com.akadns.net. (58)
14:53:40.125384 IP 192.168.1.202.52539 > 192.168.1.1.53: 29400+ A? ocsp2-lb.apple.com.akadns.net. (47)
14:53:40.127985 IP 192.168.1.202.59202 > 192.168.1.1.53: 22840+ A? gspe35-ssl.ls-apple.com.akadns.net. (52)
14:53:40.239105 IP 192.168.1.202.52096 > 192.168.1.1.53: 20951+ A? me.apple-dns.net. (34)
14:53:40.274133 IP 192.168.1.202.60317 > 192.168.1.1.53: 963+ A? fbs.smoot.apple.com. (37)
14:53:40.274308 IP 192.168.1.202.62875 > 192.168.1.1.53: 698+ A? swallow.apple.com. (35)
14:53:40.338636 IP 192.168.1.202.49637 > 192.168.1.1.53: 22567+ A? mesu-cdn.origin-apple.com.akadns.net. (54)
14:53:40.354261 IP 192.168.1.202.63092 > 192.168.1.1.53: 46266+ A? e1329.g.akamaiedge.net. (40)
14:53:44.552328 IP 192.168.1.202.3377 > 192.168.1.1.53: 45306+ A? ade.googlesyndication.com. (43)
14:53:48.306818 IP 192.168.1.202.25446 > 192.168.1.1.53: 49709+ A? clients4.google.com. (37)
14:53:50.447907 IP 192.168.1.202.60127 > 192.168.1.1.53: 31821+ A? p47-contacts.icloud.com. (41)
14:53:51.559476 IP 192.168.1.202.61919 > 192.168.1.1.53: 56332+ A? guzzoni.apple.com. (35)
14:53:56.464476 IP 192.168.1.202.59543 > 192.168.1.1.53: 12170+ A? ipcdn.apple.com. (33)
14:53:56.813759 IP 192.168.1.202.52878 > 192.168.1.1.53: 53706+ A? gsa.apple.com. (31)
14:53:57.641101 IP 192.168.1.202.52051 > 192.168.1.1.53: 35558+ A? gsas.apple.com. (32)
14:53:59.611113 IP 192.168.1.202.54286 > 192.168.1.1.53: 24754+ A? xp.apple.com. (30)
14:54:00.116670 IP 192.168.1.202.52349 > 192.168.1.1.53: 37432+ A? metrics-config.icloud.com. (43)
14:54:12.611945 IP 192.168.1.202.52036 > 192.168.1.1.53: 10754+ A? gdmf.apple.com. (32)
14:54:12.812846 IP 192.168.1.202.53288 > 192.168.1.1.53: 48721+ A? ocsp2.g.aaplimg.com. (37)
14:54:13.414329 IP 192.168.1.202.59849 > 192.168.1.1.53: 31320+ A? ocsp.digicert.com. (35)
14:54:13.676640 IP 192.168.1.202.58369 > 192.168.1.1.53: 53289+ A? configuration.apple.com. (41)
14:54:13.808702 IP 192.168.1.202.50368 > 192.168.1.1.53: 57257+ A? swscan.apple.com. (34)
14:54:14.038091 IP 192.168.1.202.53271 > 192.168.1.1.53: 48527+ A? swdist.apple.com. (34)
14:54:15.457566 IP 192.168.1.202.51006 > 192.168.1.1.53: 26604+ A? e17437.dsct.akamaiedge.net. (44)
14:54:36.503182 IP 192.168.1.202.59064 > 192.168.1.1.53: 44365+ A? gsp64-ssl.ls-apple.com.akadns.net. (51)
14:55:04.633597 IP 192.168.1.202.19774 > 192.168.1.1.53: 26681+ A? femetrics.grammarly.io. (40)
14:55:10.277338 IP 192.168.1.202.51004 > 192.168.1.1.53: 62638+ A? femetrics.grammarly.io. (40)
14:55:22.566681 IP 192.168.1.202.58464 > 192.168.1.1.53: 41764+ A? gateway.fe.apple-dns.net. (42)
14:55:45.562245 IP 192.168.1.202.51000 > 192.168.1.1.53: 59712+ A? ade.googlesyndication.com. (43)
14:56:04.287733 IP 192.168.1.202.50237 > 192.168.1.1.53: 45482+ A? treatment.grammarly.com. (41)
14:56:29.385970 IP 192.168.1.202.4611 > 192.168.1.1.53: 12888+ A? d27xxe7juh1us6.cloudfront.net. (47)
14:56:45.008960 IP 192.168.1.202.32012 > 192.168.1.1.53: 27480+ A? marketplace.visualstudio.com. (46)
14:57:10.272995 IP 192.168.1.202.61319 > 192.168.1.1.53: 57762+ A? femetrics.grammarly.io. (40)
14:58:30.305551 IP 192.168.1.202.7444 > 192.168.1.1.53: 53399+ A? googleads.g.doubleclick.net. (45)
14:58:31.338531 IP 192.168.1.202.2458 > 192.168.1.1.53: 44930+ A? dt.adsafeprotected.com. (40)
14:58:32.244597 IP 192.168.1.202.16903 > 192.168.1.1.53: 64971+ A? www.google.com. (32)
14:58:32.873202 IP 192.168.1.202.61319 > 192.168.1.1.53: 9562+ A? encrypted-tbn0.gstatic.com. (44)
14:58:33.691327 IP 192.168.1.202.4330 > 192.168.1.1.53: 61737+ A? optimizationguide-pa.googleapis.com. (53)
14:58:33.692234 IP 192.168.1.202.35831 > 192.168.1.1.53: 37741+ A? www.dropbox.com. (33)
14:58:33.692306 IP 192.168.1.202.62991 > 192.168.1.1.53: 8864+ A? cfl.dropboxstatic.com. (39)
14:58:33.692376 IP 192.168.1.202.61632 > 192.168.1.1.53: 21120+ A? fonts.googleapis.com. (38)
14:58:33.709987 IP 192.168.1.202.44031 > 192.168.1.1.53: 59497+ A? fonts.gstatic.com. (35)
14:58:34.005426 IP 192.168.1.202.55999 > 192.168.1.1.53: 2956+ A? safebrowsing.googleapis.com. (45)
14:58:34.182948 IP 192.168.1.202.59607 > 192.168.1.1.53: 9744+ A? clients4.google.com. (37)
14:58:35.390493 IP 192.168.1.202.21660 > 192.168.1.1.53: 26860+ A? bolt.dropbox.com. (34)
14:58:36.117110 IP 192.168.1.202.47477 > 192.168.1.1.53: 64754+ A? l.evidon.com. (30)
14:59:09.869817 IP 192.168.1.202.51545 > 192.168.1.1.53: 61411+ A? valid.apple.com. (33)
14:59:10.275813 IP 192.168.1.202.58465 > 192.168.1.1.53: 35413+ A? femetrics.grammarly.io. (40)
14:59:20.484850 IP 192.168.1.202.20211 > 192.168.1.1.53: 39145+ A? app.slack.com. (31)
14:59:24.350124 IP 192.168.1.202.59090 > 192.168.1.1.53: 30040+ A? play.google.com. (33)
14:59:24.394813 IP 192.168.1.202.5402 > 192.168.1.1.53: 64080+ A? adservice.google.com. (38)
14:59:25.222368 IP 192.168.1.202.64839 > 192.168.1.1.53: 18761+ A? stackoverflow.com. (35)
14:59:25.222676 IP 192.168.1.202.41104 > 192.168.1.1.53: 48494+ A? ajax.googleapis.com. (37)
14:59:25.224952 IP 192.168.1.202.59138 > 192.168.1.1.53: 58690+ A? cdn.sstatic.net. (33)
14:59:25.364703 IP 192.168.1.202.24294 > 192.168.1.1.53: 48484+ A? www.gravatar.com. (34)
14:59:25.365976 IP 192.168.1.202.40323 > 192.168.1.1.53: 26892+ A? lh6.googleusercontent.com. (43)
14:59:25.366305 IP 192.168.1.202.56692 > 192.168.1.1.53: 34469+ A? lh5.googleusercontent.com. (43)
14:59:25.548164 IP 192.168.1.202.19254 > 192.168.1.1.53: 31289+ A? qa.sockets.stackexchange.com. (46)
14:59:25.568925 IP 192.168.1.202.7956 > 192.168.1.1.53: 5711+ A? www.google-analytics.com. (42)
14:59:25.614227 IP 192.168.1.202.13237 > 192.168.1.1.53: 60804+ A? securepubads.g.doubleclick.net. (48)
14:59:25.641326 IP 192.168.1.202.40780 > 192.168.1.1.53: 20367+ A? stats.g.doubleclick.net. (41)
14:59:25.879892 IP 192.168.1.202.61482 > 192.168.1.1.53: 56604+ A? tpc.googlesyndication.com. (43)
14:59:26.044959 IP 192.168.1.202.15054 > 192.168.1.1.53: 54660+ A? media.bidr.io. (31)
14:59:26.045149 IP 192.168.1.202.11698 > 192.168.1.1.53: 18623+ A? us-east-1.event.prod.bidr.io. (46)
14:59:26.045694 IP 192.168.1.202.50417 > 192.168.1.1.53: 27963+ A? creative.statics.indeed.com. (45)
14:59:26.046948 IP 192.168.1.202.11763 > 192.168.1.1.53: 65181+ A? pxl.indeed.com. (32)
14:59:26.068962 IP 192.168.1.202.4846 > 192.168.1.1.53: 16789+ A? rtb0.doubleverify.com. (39)
14:59:26.157673 IP 192.168.1.202.51469 > 192.168.1.1.53: 6122+ A? ad.doubleclick.net. (36)
14:59:26.270404 IP 192.168.1.202.1689 > 192.168.1.1.53: 36070+ A? geo.moatads.com. (33)
14:59:26.274164 IP 192.168.1.202.5730 > 192.168.1.1.53: 35885+ A? px.moatads.com. (32)
14:59:26.276738 IP 192.168.1.202.8016 > 192.168.1.1.53: 42158+ A? match.prod.bidr.io. (36)
14:59:26.292863 IP 192.168.1.202.37421 > 192.168.1.1.53: 7154+ A? googleads4.g.doubleclick.net. (46)
14:59:26.295008 IP 192.168.1.202.1777 > 192.168.1.1.53: 63377+ A? sync.mathtag.com. (34)
14:59:26.295709 IP 192.168.1.202.37396 > 192.168.1.1.53: 8595+ A? cdn.doubleverify.com. (38)
14:59:26.379010 IP 192.168.1.202.38601 > 192.168.1.1.53: 33283+ A? tps.doubleverify.com. (38)
14:59:26.503765 IP 192.168.1.202.52136 > 192.168.1.1.53: 24921+ A? pagead2.googlesyndication.com. (47)
14:59:26.522787 IP 192.168.1.202.58738 > 192.168.1.1.53: 30053+ A? dpm.demdex.net. (32)
14:59:26.615413 IP 192.168.1.202.8667 > 192.168.1.1.53: 48480+ A? beeswaxdisplay108801632049.s.moatpixel.com. (60)
14:59:26.679626 IP 192.168.1.202.23737 > 192.168.1.1.53: 24482+ A? c.evidon.com. (30)
14:59:26.681801 IP 192.168.1.202.7499 > 192.168.1.1.53: 13152+ A? l.betrad.com. (30)
14:59:30.722062 IP 192.168.1.202.1086 > 192.168.1.1.53: 64281+ A? www.googleapis.com. (36)
15:00:04.623490 IP 192.168.1.202.16455 > 192.168.1.1.53: 37814+ A? femetrics.grammarly.io. (40)
15:00:10.724260 IP 192.168.1.202.50685 > 192.168.1.1.53: 59235+ A? deault-exp-tas-com.e-0014.e-msedge.net. (56)
15:01:10.243301 IP 192.168.1.202.64731 > 192.168.1.1.53: 56043+ A? femetrics.grammarly.io. (40)
15:01:29.398000 IP 192.168.1.202.50540 > 192.168.1.1.53: 44839+ A? d27xxe7juh1us6.cloudfront.net. (47)
15:01:53.334684 IP 192.168.1.202.58545 > 192.168.1.1.53: 10936+ A? e10499.dsce9.akamaiedge.net. (45)
15:01:53.416697 IP 192.168.1.202.49647 > 192.168.1.1.53: 23322+ A? gateway.fe.apple-dns.net. (42)
15:01:53.464292 IP 192.168.1.202.59581 > 192.168.1.1.53: 2483+ A? stocks-data-service.lb-apple.com.akadns.net. (61)
15:03:10.274714 IP 192.168.1.202.52443 > 192.168.1.1.53: 24225+ A? femetrics.grammarly.io. (40)
15:03:40.194750 IP 192.168.1.202.62479 > 192.168.1.1.53: 7074+ A? cdn-icloud-content.g.aaplimg.com. (50)
15:03:40.363931 IP 192.168.1.202.55794 > 192.168.1.1.53: 13983+ A? gateway.fe.apple-dns.net. (42)
15:05:10.267150 IP 192.168.1.202.64733 > 192.168.1.1.53: 52380+ A? femetrics.grammarly.io. (40)
15:05:20.230437 IP 192.168.1.202.51647 > 192.168.1.1.53: 31212+ A? www.google.com. (32)
15:06:04.283101 IP 192.168.1.202.64913 > 192.168.1.1.53: 48692+ A? treatment.grammarly.com. (41)
15:06:15.382830 IP 192.168.1.202.27751 > 192.168.1.1.53: 16260+ A? www.dropbox.com. (33)
15:06:29.398560 IP 192.168.1.202.58928 > 192.168.1.1.53: 3756+ A? d27xxe7juh1us6.cloudfront.net. (47)
15:06:39.788016 IP 192.168.1.202.53938 > 192.168.1.1.53: 54873+ A? time.g.aaplimg.com. (36)
15:06:43.238927 IP 192.168.1.202.20231 > 192.168.1.1.53: 23743+ A? clients4.google.com. (37)
15:07:10.267384 IP 192.168.1.202.58838 > 192.168.1.1.53: 29911+ A? femetrics.grammarly.io. (40)
15:07:14.916858 IP 192.168.1.202.12983 > 192.168.1.1.53: 8389+ A? marketplace.visualstudio.com. (46)
15:07:34.920800 IP 192.168.1.202.51081 > 192.168.1.1.53: 10110+ A? bolt.dropbox.com. (34)
15:07:42.015383 IP 192.168.1.202.22646 > 192.168.1.1.53: 24859+ A? cfl.dropboxstatic.com. (39)
15:07:42.176251 IP 192.168.1.202.63952 > 192.168.1.1.53: 60634+ A? gateway.fe.apple-dns.net. (42)
15:07:50.677276 IP 192.168.1.202.25784 > 192.168.1.1.53: 50168+ A? www.google.com. (32)
15:07:54.893798 IP 192.168.1.202.65411 > 192.168.1.1.53: 18321+ A? ogs.google.com. (32)
15:07:55.021973 IP 192.168.1.202.52407 > 192.168.1.1.53: 64100+ A? www.gstatic.com. (33)
15:07:55.022109 IP 192.168.1.202.59579 > 192.168.1.1.53: 40795+ A? ssl.gstatic.com. (33)
15:07:55.127128 IP 192.168.1.202.54184 > 192.168.1.1.53: 43937+ A? play.google.com. (33)
15:07:55.788436 IP 192.168.1.202.40166 > 192.168.1.1.53: 3570+ A? optimizationguide-pa.googleapis.com. (53)
15:07:57.031357 IP 192.168.1.202.51228 > 192.168.1.1.53: 58882+ A? safebrowsing.googleapis.com. (45)
15:07:57.044488 IP 192.168.1.202.56833 > 192.168.1.1.53: 53184+ A? encrypted-tbn0.gstatic.com. (44)
15:07:57.052264 IP 192.168.1.202.61771 > 192.168.1.1.53: 58572+ A? f-log-extension.grammarly.io. (46)
15:07:57.118469 IP 192.168.1.202.43913 > 192.168.1.1.53: 30052+ A? adservice.google.com. (38)
15:08:00.770443 IP 192.168.1.202.36753 > 192.168.1.1.53: 33818+ A? www.googleapis.com. (36)
15:08:01.906000 IP 192.168.1.202.46548 > 192.168.1.1.53: 19410+ A? help.dropbox.com. (34)
15:08:03.279977 IP 192.168.1.202.5543 > 192.168.1.1.53: 3765+ A? aem.dropbox.com. (33)
15:08:03.306428 IP 192.168.1.202.1672 > 192.168.1.1.53: 14701+ A? static.cloud.coveo.com. (40)
15:08:03.441665 IP 192.168.1.202.29624 > 192.168.1.1.53: 53449+ A? tags.tiqcdn.com. (33)
15:08:04.082533 IP 192.168.1.202.54892 > 192.168.1.1.53: 40377+ A? tag.demandbase.com. (36)
15:08:04.116454 IP 192.168.1.202.7975 > 192.168.1.1.53: 65484+ A? www.dropbox.com. (33)
15:08:04.257952 IP 192.168.1.202.61197 > 192.168.1.1.53: 13975+ A? consent.dropbox.com. (37)
15:08:04.263359 IP 192.168.1.202.13092 > 192.168.1.1.53: 45401+ A? match.prod.bidr.io. (36)
15:08:04.263601 IP 192.168.1.202.41963 > 192.168.1.1.53: 22310+ A? id.rlcdn.com. (30)
15:08:04.263838 IP 192.168.1.202.15748 > 192.168.1.1.53: 10355+ A? api.company-target.com. (40)
15:08:04.356334 IP 192.168.1.202.50240 > 192.168.1.1.53: 35183+ A? segments.company-target.com. (45)
15:08:04.380424 IP 192.168.1.202.44474 > 192.168.1.1.53: 60405+ A? dpiprodesntls.112.2o7.net. (43)
15:08:04.615478 IP 192.168.1.202.18118 > 192.168.1.1.53: 14657+ A? fonts.gstatic.com. (35)
15:08:04.640680 IP 192.168.1.202.12221 > 192.168.1.1.53: 6446+ A? l.evidon.com. (30)
15:08:04.673493 IP 192.168.1.202.47008 > 192.168.1.1.53: 15344+ A? dpm.demdex.net. (32)
15:08:04.763612 IP 192.168.1.202.56797 > 192.168.1.1.53: 322+ A? xml.alexa.com. (31)
15:08:04.824314 IP 192.168.1.202.25646 > 192.168.1.1.53: 33655+ A? dropbox.demdex.net. (36)
15:08:04.836899 IP 192.168.1.202.62327 > 192.168.1.1.53: 38447+ A? cm.everesttech.net. (36)
15:08:06.325693 IP 192.168.1.202.3433 > 192.168.1.1.53: 9138+ A? dropboxinc.tt.omtrdc.net. (42)
15:08:30.754278 IP 192.168.1.202.58750 > 192.168.1.1.53: 6405+ A? deault-exp-tas-com.e-0014.e-msedge.net. (56)
15:08:57.186376 IP 192.168.1.202.29644 > 192.168.1.1.53: 14803+ A? optimizationguide-pa.googleapis.com. (53)
15:08:57.189336 IP 192.168.1.202.55737 > 192.168.1.1.53: 6395+ A? www.gstatic.com. (33)
15:08:58.126013 IP 192.168.1.202.37352 > 192.168.1.1.53: 47689+ A? encrypted-tbn0.gstatic.com. (44)
15:08:58.455085 IP 192.168.1.202.61203 > 192.168.1.1.53: 3582+ A? safebrowsing.googleapis.com. (45)
15:09:02.205409 IP 192.168.1.202.64019 > 192.168.1.1.53: 8397+ A? ssl.gstatic.com. (33)
15:09:03.302113 IP 192.168.1.202.36495 > 192.168.1.1.53: 13971+ A? googleads.g.doubleclick.net. (45)
15:09:03.306282 IP 192.168.1.202.53006 > 192.168.1.1.53: 64636+ A? px.moatads.com. (32)
15:09:04.164580 IP 192.168.1.202.1212 > 192.168.1.1.53: 63442+ A? tpsc-ue1.doubleverify.com. (43)
15:09:04.169292 IP 192.168.1.202.33099 > 192.168.1.1.53: 59030+ A? beeswaxdisplay108801632049.s.moatpixel.com. (60)
15:09:04.172370 IP 192.168.1.202.6058 > 192.168.1.1.53: 50046+ A? www.google-analytics.com. (42)
15:09:04.204080 IP 192.168.1.202.25810 > 192.168.1.1.53: 52759+ A? pagead2.googlesyndication.com. (47)
15:09:10.261212 IP 192.168.1.202.53377 > 192.168.1.1.53: 19178+ A? femetrics.grammarly.io. (40)
15:09:24.819194 IP 192.168.1.202.17668 > 192.168.1.1.53: 36640+ A? alive.github.com. (34)
15:09:36.662111 IP 192.168.1.202.61448 > 192.168.1.1.53: 32644+ A? gateway.fe.apple-dns.net. (42)
15:09:36.763095 IP 192.168.1.202.52664 > 192.168.1.1.53: 13188+ A? stocks-data-service.lb-apple.com.akadns.net. (61)
15:09:36.771153 IP 192.168.1.202.60557 > 192.168.1.1.53: 30237+ A? e10499.dsce9.akamaiedge.net. (45)
15:09:44.199160 IP 192.168.1.202.23491 > 192.168.1.1.53: 27730+ A? app.slack.com. (31)
15:10:04.613413 IP 192.168.1.202.35697 > 192.168.1.1.53: 61510+ A? femetrics.grammarly.io. (40)
15:10:20.496305 IP 192.168.1.202.5545 > 192.168.1.1.53: 12106+ A? www.google.com. (32)
15:10:36.803184 IP 192.168.1.202.52441 > 192.168.1.1.53: 59985+ A? c.1password.com. (33)
15:10:36.803526 IP 192.168.1.202.59618 > 192.168.1.1.53: 19045+ A? watchtower.1password.com. (42)
15:10:39.355657 IP 192.168.1.202.64330 > 192.168.1.1.53: 35723+ A? op7.agilebits.com. (35)
15:10:39.529102 IP 192.168.1.202.59478 > 192.168.1.1.53: 52617+ A? 1password.com. (31)
15:11:04.734209 IP 192.168.1.202.63182 > 192.168.1.1.53: 54778+ A? femetrics.grammarly.io. (40)
15:11:38.340608 IP 192.168.1.202.17184 > 192.168.1.1.53: 48873+ A? www.google.com. (32)
15:11:42.839731 IP 192.168.1.202.16702 > 192.168.1.1.53: 22104+ A? play.google.com. (33)
15:11:42.846087 IP 192.168.1.202.39035 > 192.168.1.1.53: 41512+ A? encrypted-tbn0.gstatic.com. (44)
15:11:42.957666 IP 192.168.1.202.63073 > 192.168.1.1.53: 40145+ A? adservice.google.com. (38)
15:11:43.507613 IP 192.168.1.202.45091 > 192.168.1.1.53: 19358+ A? beeswaxdisplay108801632049.s.moatpixel.com. (60)
15:11:43.507917 IP 192.168.1.202.65220 > 192.168.1.1.53: 14328+ A? px.moatads.com. (32)
15:11:43.513577 IP 192.168.1.202.18502 > 192.168.1.1.53: 6373+ A? www.google-analytics.com. (42)
15:11:43.917945 IP 192.168.1.202.58364 > 192.168.1.1.53: 38639+ A? beap-bc.yahoo.com. (35)
15:11:43.919658 IP 192.168.1.202.62746 > 192.168.1.1.53: 6717+ A? dt.adsafeprotected.com. (40)
15:11:44.912507 IP 192.168.1.202.54618 > 192.168.1.1.53: 35392+ A? stackoverflow.com. (35)
15:11:45.478208 IP 192.168.1.202.14814 > 192.168.1.1.53: 18863+ A? i.stack.imgur.com. (35)
15:11:45.478369 IP 192.168.1.202.17196 > 192.168.1.1.53: 49379+ A? www.gravatar.com. (34)
15:11:45.482303 IP 192.168.1.202.18061 > 192.168.1.1.53: 34072+ A? safebrowsing.googleapis.com. (45)
15:11:45.482972 IP 192.168.1.202.50145 > 192.168.1.1.53: 11347+ A? www.googletagmanager.com. (42)
15:11:45.751290 IP 192.168.1.202.63341 > 192.168.1.1.53: 36515+ A? securepubads.g.doubleclick.net. (48)
15:11:45.794717 IP 192.168.1.202.64927 > 192.168.1.1.53: 977+ A? qa.sockets.stackexchange.com. (46)
15:11:46.155817 IP 192.168.1.202.8439 > 192.168.1.1.53: 26490+ A? stats.g.doubleclick.net. (41)
15:11:46.188783 IP 192.168.1.202.58657 > 192.168.1.1.53: 32996+ A? clc.stackoverflow.com. (39)
15:11:46.189683 IP 192.168.1.202.38290 > 192.168.1.1.53: 49649+ A? cdn.doubleverify.com. (38)
15:11:46.270679 IP 192.168.1.202.17933 > 192.168.1.1.53: 9714+ A? media.bidr.io. (31)
15:11:46.270867 IP 192.168.1.202.64074 > 192.168.1.1.53: 9384+ A? us-east-1.event.prod.bidr.io. (46)
15:11:46.271019 IP 192.168.1.202.27014 > 192.168.1.1.53: 56706+ A? creative.statics.indeed.com. (45)
15:11:46.273000 IP 192.168.1.202.43051 > 192.168.1.1.53: 46759+ A? pxl.indeed.com. (32)
15:11:46.444399 IP 192.168.1.202.33585 > 192.168.1.1.53: 23162+ A? www.googleapis.com. (36)
15:11:46.458303 IP 192.168.1.202.40673 > 192.168.1.1.53: 42093+ A? rtb0.doubleverify.com. (39)
15:11:46.516422 IP 192.168.1.202.62473 > 192.168.1.1.53: 47934+ A? geo.moatads.com. (33)
15:11:46.522648 IP 192.168.1.202.12052 > 192.168.1.1.53: 25826+ A? match.prod.bidr.io. (36)
15:11:46.553942 IP 192.168.1.202.1981 > 192.168.1.1.53: 59671+ A? rtbc-ue1.doubleverify.com. (43)
15:11:46.554165 IP 192.168.1.202.18637 > 192.168.1.1.53: 39619+ A? ad.doubleclick.net. (36)
15:11:46.691737 IP 192.168.1.202.35058 > 192.168.1.1.53: 3030+ A? googleads4.g.doubleclick.net. (46)
15:11:46.693251 IP 192.168.1.202.58413 > 192.168.1.1.53: 8814+ A? sync.mathtag.com. (34)
15:11:46.737188 IP 192.168.1.202.14731 > 192.168.1.1.53: 53199+ A? fonts.gstatic.com. (35)
15:11:46.746819 IP 192.168.1.202.54459 > 192.168.1.1.53: 23275+ A? c.evidon.com. (30)
15:11:46.751608 IP 192.168.1.202.20393 > 192.168.1.1.53: 43848+ A? tps.doubleverify.com. (38)
15:11:46.821601 IP 192.168.1.202.3599 > 192.168.1.1.53: 17929+ A? dpm.demdex.net. (32)
15:11:46.859768 IP 192.168.1.202.54076 > 192.168.1.1.53: 36982+ A? tpsc-ue1.doubleverify.com. (43)
15:11:46.938546 IP 192.168.1.202.11266 > 192.168.1.1.53: 58953+ A? l.betrad.com. (30)
15:11:47.081519 IP 192.168.1.202.53900 > 192.168.1.1.53: 63191+ A? tpc.googlesyndication.com. (43)
15:11:53.272905 IP 192.168.1.202.10705 > 192.168.1.1.53: 47667+ A? clients4.google.com. (37)
15:11:57.390821 IP 192.168.1.202.1524 > 192.168.1.1.53: 3957+ A? ade.googlesyndication.com. (43)
15:13:05.817796 IP 192.168.1.202.60057 > 192.168.1.1.53: 2375+ A? femetrics.grammarly.io. (40)
15:13:08.830662 IP 192.168.1.202.63798 > 192.168.1.1.53: 62508+ A? deault-exp-tas-com.e-0014.e-msedge.net. (56)
15:13:25.509243 IP 192.168.1.202.24032 > 192.168.1.1.53: 51172+ A? play.google.com. (33)
15:13:47.495739 IP 192.168.1.202.49955 > 192.168.1.1.53: 58506+ A? ade.googlesyndication.com. (43)
15:13:56.470317 IP 192.168.1.202.33842 > 192.168.1.1.53: 6043+ A? clientservices.googleapis.com. (47)
15:14:51.485229 IP 192.168.1.202.55105 > 192.168.1.1.53: 14636+ A? safebrowsing-proxy.g.aaplimg.com. (50)
15:14:51.534117 IP 192.168.1.202.63349 > 192.168.1.1.53: 20201+ A? gateway.fe.apple-dns.net. (42)
15:15:04.612174 IP 192.168.1.202.34248 > 192.168.1.1.53: 9428+ A? femetrics.grammarly.io. (40)
15:15:06.929548 IP 192.168.1.202.54123 > 192.168.1.1.53: 4808+ A? femetrics.grammarly.io. (40)
15:15:21.243314 IP 192.168.1.202.49693 > 192.168.1.1.53: 14255+ A? weather-data.apple.com. (40)
15:15:32.402386 IP 192.168.1.202.53684 > 192.168.1.1.53: 54775+ A? treatment.grammarly.com. (41)
15:15:47.505668 IP 192.168.1.202.52791 > 192.168.1.1.53: 32410+ A? ade.googlesyndication.com. (43)
15:16:04.267203 IP 192.168.1.202.51209 > 192.168.1.1.53: 34373+ A? treatment.grammarly.com. (41)
15:16:29.399459 IP 192.168.1.202.41129 > 192.168.1.1.53: 63639+ A? d27xxe7juh1us6.cloudfront.net. (47)
15:16:33.995102 IP 192.168.1.202.9806 > 192.168.1.1.53: 50855+ A? googleads.g.doubleclick.net. (45)
15:16:35.969687 IP 192.168.1.202.3709 > 192.168.1.1.53: 23956+ A? px.moatads.com. (32)
15:16:38.456033 IP 192.168.1.202.15189 > 192.168.1.1.53: 16751+ A? www.google.com. (32)
15:16:42.005887 IP 192.168.1.202.16047 > 192.168.1.1.53: 50898+ A? beeswaxdisplay108801632049.s.moatpixel.com. (60)
15:16:42.006076 IP 192.168.1.202.51817 > 192.168.1.1.53: 59032+ A? optimizationguide-pa.googleapis.com. (53)
15:16:42.006958 IP 192.168.1.202.56944 > 192.168.1.1.53: 12999+ A? fonts.gstatic.com. (35)
15:16:42.007047 IP 192.168.1.202.9638 > 192.168.1.1.53: 64601+ A? www.gstatic.com. (33)
15:16:42.156465 IP 192.168.1.202.62559 > 192.168.1.1.53: 6582+ A? pagead2.googlesyndication.com. (47)
15:16:42.156703 IP 192.168.1.202.23460 > 192.168.1.1.53: 45579+ A? www.google-analytics.com. (42)
15:16:42.956091 IP 192.168.1.202.15472 > 192.168.1.1.53: 7932+ A? safebrowsing.googleapis.com. (45)
15:16:42.977301 IP 192.168.1.202.30493 > 192.168.1.1.53: 46186+ A? play.google.com. (33)
15:16:42.984308 IP 192.168.1.202.64614 > 192.168.1.1.53: 56584+ A? encrypted-tbn0.gstatic.com. (44)
15:16:43.012953 IP 192.168.1.202.52689 > 192.168.1.1.53: 52452+ A? encrypted-tbn1.gstatic.com. (44)
15:16:43.058557 IP 192.168.1.202.9710 > 192.168.1.1.53: 27202+ A? t0.gstatic.com. (32)
15:16:43.162138 IP 192.168.1.202.18601 > 192.168.1.1.53: 37487+ A? adservice.google.com. (38)
15:16:43.613339 IP 192.168.1.202.36248 > 192.168.1.1.53: 20052+ A? realpython.com. (32)
15:16:43.870651 IP 192.168.1.202.30490 > 192.168.1.1.53: 57748+ A? cdn.realpython.com. (36)
15:16:43.873016 IP 192.168.1.202.47944 > 192.168.1.1.53: 24921+ A? files.realpython.com. (38)
15:16:44.133388 IP 192.168.1.202.38096 > 192.168.1.1.53: 24075+ A? srv.realpython.net. (36)
15:16:44.133838 IP 192.168.1.202.48847 > 192.168.1.1.53: 28476+ A? realpython.disqus.com. (39)
15:16:44.134150 IP 192.168.1.202.24300 > 192.168.1.1.53: 25700+ A? cdn.onesignal.com. (35)
15:16:44.477616 IP 192.168.1.202.25448 > 192.168.1.1.53: 17164+ A? disqus.com. (28)
15:16:44.477770 IP 192.168.1.202.50442 > 192.168.1.1.53: 52604+ A? c.disquscdn.com. (33)
15:16:44.490731 IP 192.168.1.202.4660 > 192.168.1.1.53: 22980+ A? stats.g.doubleclick.net. (41)
15:16:44.584351 IP 192.168.1.202.57024 > 192.168.1.1.53: 21241+ A? tag.getdrip.com. (33)
15:16:44.585708 IP 192.168.1.202.45259 > 192.168.1.1.53: 13175+ A? connect.facebook.net. (38)
15:16:44.766996 IP 192.168.1.202.18544 > 192.168.1.1.53: 54748+ A? d14jnfavjicsbe.cloudfront.net. (47)
15:16:44.935267 IP 192.168.1.202.46912 > 192.168.1.1.53: 13680+ A? img.realpython.net. (36)
15:16:44.946067 IP 192.168.1.202.9013 > 192.168.1.1.53: 21248+ A? www.facebook.com. (34)
15:16:45.111529 IP 192.168.1.202.36036 > 192.168.1.1.53: 43556+ A? api.getdrip.com. (33)
15:16:45.144234 IP 192.168.1.202.14725 > 192.168.1.1.53: 22256+ A? onesignal.com. (31)
15:16:45.644397 IP 192.168.1.202.8887 > 192.168.1.1.53: 41065+ A? www.dripuploads.com. (37)
15:16:46.021822 IP 192.168.1.202.39750 > 192.168.1.1.53: 27642+ A? xml.alexa.com. (31)
15:16:46.690137 IP 192.168.1.202.28820 > 192.168.1.1.53: 42377+ A? www.googleapis.com. (36)
15:16:53.160346 IP 192.168.1.202.18050 > 192.168.1.1.53: 45272+ A? clients4.google.com. (37)
15:16:59.597370 IP 192.168.1.202.5861 > 192.168.1.1.53: 49355+ A? stackoverflow.com. (35)
15:16:59.597594 IP 192.168.1.202.30826 > 192.168.1.1.53: 18923+ A? ajax.googleapis.com. (37)
15:16:59.599722 IP 192.168.1.202.22706 > 192.168.1.1.53: 31761+ A? cdn.sstatic.net. (33)
15:17:06.181552 IP 192.168.1.202.23912 > 192.168.1.1.53: 52481+ A? probproofs.slack.com. (38)
15:17:08.023397 IP 192.168.1.202.50461 > 192.168.1.1.53: 17367+ A? femetrics.grammarly.io. (40)
15:17:09.930889 IP 192.168.1.202.43702 > 192.168.1.1.53: 50924+ A? www.reddit.com. (32)
15:17:09.986741 IP 192.168.1.202.5131 > 192.168.1.1.53: 52505+ A? alb.reddit.com. (32)
15:17:10.647360 IP 192.168.1.202.31083 > 192.168.1.1.53: 58754+ A? gql.reddit.com. (32)
15:17:27.067889 IP 192.168.1.202.51511 > 192.168.1.1.53: 28723+ A? dns.weixin.qq.com.cn. (38)
15:17:28.202412 IP 192.168.1.202.53672 > 192.168.1.1.53: 10826+ A? gateway.fe.apple-dns.net. (42)
15:17:28.238025 IP 192.168.1.202.60567 > 192.168.1.1.53: 4295+ A? stocks-data-service.lb-apple.com.akadns.net. (61)
15:17:28.238230 IP 192.168.1.202.64103 > 192.168.1.1.53: 38210+ A? stocks-sparkline-lb.apple.com.akadns.net. (58)
15:17:28.253599 IP 192.168.1.202.55541 > 192.168.1.1.53: 29973+ A? e16126.dscg.akamaiedge.net. (44)
15:17:33.941533 IP 192.168.1.202.40968 > 192.168.1.1.53: 21119+ A? lh6.googleusercontent.com. (43)
15:17:33.965437 IP 192.168.1.202.31685 > 192.168.1.1.53: 6038+ A? www.gravatar.com. (34)
15:17:33.984396 IP 192.168.1.202.39424 > 192.168.1.1.53: 52602+ A? lh3.googleusercontent.com. (43)
15:17:34.092823 IP 192.168.1.202.25661 > 192.168.1.1.53: 22367+ A? lh5.googleusercontent.com. (43)
15:17:34.454909 IP 192.168.1.202.49321 > 192.168.1.1.53: 25271+ A? qa.sockets.stackexchange.com. (46)
15:17:34.495359 IP 192.168.1.202.60573 > 192.168.1.1.53: 45937+ A? securepubads.g.doubleclick.net. (48)
15:17:34.669840 IP 192.168.1.202.16637 > 192.168.1.1.53: 29560+ A? rtb0.doubleverify.com. (39)
15:17:34.755579 IP 192.168.1.202.6819 > 192.168.1.1.53: 43567+ A? ad.doubleclick.net. (36)
15:17:34.809967 IP 192.168.1.202.1840 > 192.168.1.1.53: 55630+ A? media.bidr.io. (31)
15:17:34.810140 IP 192.168.1.202.6335 > 192.168.1.1.53: 33632+ A? us-east-1.event.prod.bidr.io. (46)
15:17:34.879097 IP 192.168.1.202.17615 > 192.168.1.1.53: 50559+ A? googleads4.g.doubleclick.net. (46)
15:17:34.879689 IP 192.168.1.202.2889 > 192.168.1.1.53: 20682+ A? creative.statics.indeed.com. (45)
15:17:34.900215 IP 192.168.1.202.53151 > 192.168.1.1.53: 60622+ A? sync.mathtag.com. (34)
15:17:34.939770 IP 192.168.1.202.56401 > 192.168.1.1.53: 59927+ A? tps.doubleverify.com. (38)
15:17:35.102237 IP 192.168.1.202.1329 > 192.168.1.1.53: 24742+ A? dpm.demdex.net. (32)
15:17:35.170930 IP 192.168.1.202.13269 > 192.168.1.1.53: 36757+ A? cdn.doubleverify.com. (38)
15:17:35.173500 IP 192.168.1.202.46260 > 192.168.1.1.53: 52256+ A? pxl.indeed.com. (32)
15:17:35.173774 IP 192.168.1.202.62495 > 192.168.1.1.53: 3640+ A? match.prod.bidr.io. (36)
15:17:35.193712 IP 192.168.1.202.40685 > 192.168.1.1.53: 63828+ A? geo.moatads.com. (33)
15:17:35.287151 IP 192.168.1.202.41973 > 192.168.1.1.53: 22604+ A? c.evidon.com. (30)
15:17:35.290920 IP 192.168.1.202.65413 > 192.168.1.1.53: 33079+ A? l.betrad.com. (30)
15:17:38.333406 IP 192.168.1.202.7149 > 192.168.1.1.53: 10067+ A? tpc.googlesyndication.com. (43)
15:17:39.565242 IP 192.168.1.202.21615 > 192.168.1.1.53: 59620+ A? external-preview.redd.it. (42)
15:17:46.429971 IP 192.168.1.202.17869 > 192.168.1.1.53: 19584+ A? ade.googlesyndication.com. (43)
15:19:08.593016 IP 192.168.1.202.52980 > 192.168.1.1.53: 8241+ A? femetrics.grammarly.io. (40)
15:19:36.525156 IP 192.168.1.202.8870 > 192.168.1.1.53: 63910+ A? ade.googlesyndication.com. (43)
15:20:04.604555 IP 192.168.1.202.23877 > 192.168.1.1.53: 56895+ A? femetrics.grammarly.io. (40)
15:21:08.845358 IP 192.168.1.202.62942 > 192.168.1.1.53: 33566+ A? femetrics.grammarly.io. (40)
15:21:22.731815 IP 192.168.1.202.58963 > 192.168.1.1.53: 54733+ A? clients4.google.com. (37)
15:21:29.416018 IP 192.168.1.202.27964 > 192.168.1.1.53: 56079+ A? d27xxe7juh1us6.cloudfront.net. (47)
15:21:37.515327 IP 192.168.1.202.3696 > 192.168.1.1.53: 18006+ A? ade.googlesyndication.com. (43)
15:23:09.521590 IP 192.168.1.202.50888 > 192.168.1.1.53: 48254+ A? femetrics.grammarly.io. (40)
15:23:51.614077 IP 192.168.1.202.25149 > 192.168.1.1.53: 46655+ A? edgeapi.slack.com. (35)
15:24:23.552884 IP 192.168.1.202.33056 > 192.168.1.1.53: 1393+ A? play.google.com. (33)
15:25:09.956104 IP 192.168.1.202.49667 > 192.168.1.1.53: 37723+ A? femetrics.grammarly.io. (40)
15:25:54.348064 IP 192.168.1.202.52288 > 192.168.1.1.53: 35158+ A? init.push.apple.com. (37)
15:25:54.495811 IP 192.168.1.202.58456 > 192.168.1.1.53: 30896+ A? 43-courier.push.apple.com. (43)
15:26:04.262139 IP 192.168.1.202.60269 > 192.168.1.1.53: 25279+ A? treatment.grammarly.com. (41)
15:26:05.330134 IP 192.168.1.202.25437 > 192.168.1.1.53: 1618+ A? clients4.google.com. (37)
15:26:08.949211 IP 192.168.1.202.55132 > 192.168.1.1.53: 38670+ A? az764295.vo.msecnd.net. (40)
15:26:09.492016 IP 192.168.1.202.59384 > 192.168.1.1.53: 27404+ A? gateway.fe.apple-dns.net. (42)
15:26:09.640940 IP 192.168.1.202.50265 > 192.168.1.1.53: 46253+ A? stocks-data-service.lb-apple.com.akadns.net. (61)
15:26:29.411107 IP 192.168.1.202.11356 > 192.168.1.1.53: 24475+ A? d27xxe7juh1us6.cloudfront.net. (47)
15:27:10.256141 IP 192.168.1.202.56712 > 192.168.1.1.53: 18853+ A? femetrics.grammarly.io. (40)
15:29:10.255061 IP 192.168.1.202.60486 > 192.168.1.1.53: 3673+ A? femetrics.grammarly.io. (40)
15:30:10.689833 IP 192.168.1.202.56134 > 192.168.1.1.53: 50793+ A? deault-exp-tas-com.e-0014.e-msedge.net. (56)
15:31:10.250417 IP 192.168.1.202.52714 > 192.168.1.1.53: 38158+ A? femetrics.grammarly.io. (40)
15:31:29.426545 IP 192.168.1.202.64583 > 192.168.1.1.53: 57176+ A? d27xxe7juh1us6.cloudfront.net. (47)
15:31:35.535897 IP 192.168.1.202.44311 > 192.168.1.1.53: 29312+ A? tpsc-ue1.doubleverify.com. (43)
15:33:10.251271 IP 192.168.1.202.56583 > 192.168.1.1.53: 6519+ A? femetrics.grammarly.io. (40)
15:33:58.889810 IP 192.168.1.202.31351 > 192.168.1.1.53: 50152+ A? mtalk.google.com. (34)
15:33:58.922427 IP 192.168.1.202.64115 > 192.168.1.1.53: 174+ A? time.apple.com. (32)
15:34:00.622183 IP 192.168.1.202.19467 > 192.168.1.1.53: 42646+ A? wss-primary.slack.com. (39)
15:34:01.612083 IP 192.168.1.202.57513 > 192.168.1.1.53: 21745+ A? gateway.fe.apple-dns.net. (42)
15:34:01.612300 IP 192.168.1.202.53010 > 192.168.1.1.53: 51618+ A? stocks-data-service.lb-apple.com.akadns.net. (61)
15:34:02.013694 IP 192.168.1.202.56873 > 192.168.1.1.53: 210+ A? metrics.icloud.com. (36)
15:34:08.392568 IP 192.168.1.202.21617 > 192.168.1.1.53: 56107+ A? alive.github.com. (34)
15:34:18.751110 IP 192.168.1.202.52182 > 192.168.1.1.53: 36180+ A? vortex.data.microsoft.com. (43)
15:34:20.111355 IP 192.168.1.202.55623 > 192.168.1.1.53: 62590+ A? calendars.icloud.com. (38)
15:34:20.114294 IP 192.168.1.202.55874 > 192.168.1.1.53: 11196+ A? p47-caldav.icloud.com. (39)
15:34:20.333374 IP 192.168.1.202.60916 > 192.168.1.1.53: 30061+ A? bag.itunes.apple.com. (38)
15:34:20.431319 IP 192.168.1.202.56630 > 192.168.1.1.53: 63703+ A? gateway.icloud.com. (36)
15:34:20.576227 IP 192.168.1.202.57373 > 192.168.1.1.53: 40332+ A? mask.icloud.com. (33)
15:34:20.763502 IP 192.168.1.202.62931 > 192.168.1.1.53: 53505+ A? c.apple.news. (30)
15:34:31.871530 IP 192.168.1.202.47141 > 192.168.1.1.53: 60352+ A? edgeapi.slack.com. (35)
15:35:10.698918 IP 192.168.1.202.63200 > 192.168.1.1.53: 47515+ A? femetrics.grammarly.io. (40)
15:35:25.824113 IP 192.168.1.202.62710 > 192.168.1.1.53: 26994+ A? asimov.vortex.data.trafficmanager.net. (55)
15:35:39.016871 IP 192.168.1.202.47751 > 192.168.1.1.53: 22882+ A? qa.sockets.stackexchange.com. (46)
15:35:58.444445 IP 192.168.1.202.59730 > 192.168.1.1.53: 27688+ A? asimov.vortex.data.trafficmanager.net. (55)
15:36:04.806757 IP 192.168.1.202.53246 > 192.168.1.1.53: 55566+ A? treatment.grammarly.com. (41)
15:36:23.408834 IP 192.168.1.202.48949 > 192.168.1.1.53: 21775+ A? clients4.google.com. (37)
15:36:25.508214 IP 192.168.1.202.58237 > 192.168.1.1.53: 17666+ A? vortex.data.microsoft.com. (43)
15:36:27.914174 IP 192.168.1.202.56490 > 192.168.1.1.53: 11701+ A? mmhead.c2c.wechat.com. (39)
15:36:29.980019 IP 192.168.1.202.21747 > 192.168.1.1.53: 62762+ A? d27xxe7juh1us6.cloudfront.net. (47)
15:37:10.806313 IP 192.168.1.202.50333 > 192.168.1.1.53: 48997+ A? femetrics.grammarly.io. (40)
15:37:27.223975 IP 192.168.1.202.52289 > 192.168.1.1.53: 64187+ A? asimov.vortex.data.trafficmanager.net. (55)
15:37:33.064904 IP 192.168.1.202.53944 > 192.168.1.1.53: 38739+ A? cdn-icloud-content.g.aaplimg.com. (50)
15:37:33.234204 IP 192.168.1.202.57114 > 192.168.1.1.53: 23002+ A? gateway.fe.apple-dns.net. (42)
15:38:30.755218 IP 192.168.1.202.61284 > 192.168.1.1.53: 16464+ A? default.exp-tas.com. (37)
15:38:34.074721 IP 192.168.1.202.50755 > 192.168.1.1.53: 9164+ A? vortex.data.microsoft.com. (43)
15:38:43.046936 IP 192.168.1.202.44461 > 192.168.1.1.53: 13848+ A? safebrowsing.googleapis.com. (45)
15:39:10.805734 IP 192.168.1.202.50153 > 192.168.1.1.53: 18310+ A? femetrics.grammarly.io. (40)
15:39:35.996979 IP 192.168.1.202.63526 > 192.168.1.1.53: 5395+ A? asimov.vortex.data.trafficmanager.net. (55)
15:40:34.089213 IP 192.168.1.202.53406 > 192.168.1.1.53: 60404+ A? vortex.data.microsoft.com. (43)
15:41:08.375686 IP 192.168.1.202.58679 > 192.168.1.1.53: 29463+ A? femetrics.grammarly.io. (40)
15:41:29.997189 IP 192.168.1.202.28997 > 192.168.1.1.53: 14349+ A? d27xxe7juh1us6.cloudfront.net. (47)
15:41:36.017162 IP 192.168.1.202.51431 > 192.168.1.1.53: 1035+ A? asimov.vortex.data.trafficmanager.net. (55)
15:42:18.988019 IP 192.168.1.202.6395 > 192.168.1.1.53: 63906+ A? default.exp-tas.com. (37)
15:42:19.214195 IP 192.168.1.202.59306 > 192.168.1.1.53: 23795+ A? dc.services.visualstudio.com. (46)
15:42:23.438641 IP 192.168.1.202.27303 > 192.168.1.1.53: 53776+ A? vscodeexperiments.azureedge.net. (49)
15:42:35.770534 IP 192.168.1.202.60111 > 192.168.1.1.53: 57790+ A? vortex.data.microsoft.com. (43)
15:43:09.443316 IP 192.168.1.202.61360 > 192.168.1.1.53: 54445+ A? femetrics.grammarly.io. (40)
15:43:34.101827 IP 192.168.1.202.52267 > 192.168.1.1.53: 47499+ A? tools.google.com. (34)
15:43:34.178472 IP 192.168.1.202.52377 > 192.168.1.1.53: 53575+ A? ocsp.pki.goog. (31)
15:43:37.077457 IP 192.168.1.202.15237 > 192.168.1.1.53: 13974+ A? update.code.visualstudio.com. (46)
15:43:37.130171 IP 192.168.1.202.47875 > 192.168.1.1.53: 59217+ A? marketplace.visualstudio.com. (46)
15:43:37.445246 IP 192.168.1.202.65458 > 192.168.1.1.53: 52545+ A? deault-exp-tas-com.e-0014.e-msedge.net. (56)
15:43:38.451551 IP 192.168.1.202.54616 > 192.168.1.1.53: 47155+ A? education.github.com. (38)
15:43:39.605075 IP 192.168.1.202.7134 > 192.168.1.1.53: 55226+ A? update.googleapis.com. (39)
15:43:39.702144 IP 192.168.1.202.64831 > 192.168.1.1.53: 65177+ A? edgedl.me.gvt1.com. (36)
15:43:40.811872 IP 192.168.1.202.65007 > 192.168.1.1.53: 61472+ A? mobile.events.data.microsoft.com. (50)
15:43:42.785502 IP 192.168.1.202.61666 > 192.168.1.1.53: 23828+ A? global.in.ai.monitor.azure.com. (48)
15:43:44.220868 IP 192.168.1.202.45124 > 192.168.1.1.53: 50109+ A? googleads.g.doubleclick.net. (45)
15:43:44.225424 IP 192.168.1.202.51374 > 192.168.1.1.53: 13311+ A? px.moatads.com. (32)
15:43:44.323083 IP 192.168.1.202.65410 > 192.168.1.1.53: 55690+ A? edgeapi.slack.com. (35)
15:43:45.709961 IP 192.168.1.202.58292 > 192.168.1.1.53: 44067+ A? gateway.fe.apple-dns.net. (42)
15:43:45.839470 IP 192.168.1.202.51789 > 192.168.1.1.53: 45393+ A? stocks-data-service.apple.com. (47)
15:43:45.839680 IP 192.168.1.202.53158 > 192.168.1.1.53: 59662+ A? stocks-sparkline.apple.com. (44)
15:43:49.971708 IP 192.168.1.202.54162 > 192.168.1.1.53: 6016+ A? capi.grammarly.com. (36)
15:43:52.110304 IP 192.168.1.202.59721 > 192.168.1.1.53: 52575+ A? gnar.grammarly.com. (36)
15:43:57.025347 IP 192.168.1.202.21477 > 192.168.1.1.53: 25527+ A? clientservices.googleapis.com. (47)
15:43:58.585472 IP 192.168.1.202.49741 > 192.168.1.1.53: 61660+ A? mmsns.c2c.wechat.com. (38)
15:44:06.930589 IP 192.168.1.202.51190 > 192.168.1.1.53: 55285+ A? asimov.vortex.data.trafficmanager.net. (55)
15:44:21.098876 IP 192.168.1.202.63847 > 192.168.1.1.53: 19664+ A? mmhead.c2c.wechat.com. (39)
15:44:22.933998 IP 192.168.1.202.43963 > 192.168.1.1.53: 47750+ A? www.google.com. (32)
15:44:28.025251 IP 192.168.1.202.51862 > 192.168.1.1.53: 14537+ A? mmsns.c2c.wechat.com. (38)
15:44:40.313090 IP 192.168.1.202.54200 > 192.168.1.1.53: 5024+ A? global.in.ai.monitor.azure.com. (48)
15:44:50.412321 IP 192.168.1.202.55556 > 192.168.1.1.53: 61367+ A? femetrics.grammarly.io. (40)
15:44:55.179735 IP 192.168.1.202.56384 > 192.168.1.1.53: 7515+ A? safebrowsing-proxy.g.aaplimg.com. (50)
15:45:10.397226 IP 192.168.1.202.56427 > 192.168.1.1.53: 29274+ A? vortex.data.microsoft.com. (43)
15:45:16.384359 IP 192.168.1.202.51113 > 192.168.1.1.53: 32100+ A? global.in.ai.monitor.azure.com. (48)
15:45:52.103484 IP 192.168.1.202.54545 > 192.168.1.1.53: 37807+ A? femetrics.grammarly.io. (40)
15:45:56.966035 IP 192.168.1.202.61263 > 192.168.1.1.53: 17528+ A? deault-exp-tas-com.e-0014.e-msedge.net. (56)