00:07:01.724174 IP 192.168.1.202.51975 > 192.168.1.1.53: 22195+ A? time.apple.com. (32)
00:07:01.879356 IP 192.168.1.202.63169 > 192.168.1.1.53: 63326+ A? cdn-icloud-content.g.aaplimg.com. (50)
00:07:01.881390 IP 192.168.1.202.49408 > 192.168.1.1.53: 1905+ A? weather-data.apple.com. (40)
00:07:02.025359 IP 192.168.1.202.61976 > 192.168.1.1.53: 45670+ A? default.exp-tas.com. (37)
00:07:02.232893 IP 192.168.1.202.31107 > 192.168.1.1.53: 14831+ A? chat.google.com. (33)
00:07:02.353270 IP 192.168.1.202.63929 > 192.168.1.1.53: 46034+ A? gateway.fe.apple-dns.net. (42)
00:07:02.384066 IP 192.168.1.202.52888 > 192.168.1.1.53: 26985+ A? proxy.safebrowsing.apple. (42)
00:07:02.985835 IP 192.168.1.202.54984 > 192.168.1.1.53: 19058+ A? fbs.smoot.apple.com. (37)
00:07:02.986664 IP 192.168.1.202.50508 > 192.168.1.1.53: 4376+ A? swallow.apple.com. (35)
00:07:02.996359 IP 192.168.1.202.63487 > 192.168.1.1.53: 4111+ A? configuration.ls.apple.com. (44)
00:07:03.897124 IP 192.168.1.202.28254 > 192.168.1.1.53: 17309+ A? probproofs.slack.com. (38)
00:07:04.215952 IP 192.168.1.202.9334 > 192.168.1.1.53: 23786+ A? edgeapi.slack.com. (35)
00:07:08.824243 IP 192.168.1.202.16473 > 192.168.1.1.53: 21709+ A? mtalk.google.com. (34)
00:07:10.091788 IP 192.168.1.202.59655 > 192.168.1.1.53: 63581+ A? addons-pa.clients6.google.com. (47)
00:07:11.300575 IP 192.168.1.202.4972 > 192.168.1.1.53: 22209+ A? signaler-pa.clients6.google.com. (49)
00:07:11.784086 IP 192.168.1.202.12318 > 192.168.1.1.53: 119+ A? safebrowsing.googleapis.com. (45)
00:07:23.136266 IP 192.168.1.202.62136 > 192.168.1.1.53: 1207+ A? vortex.data.microsoft.com. (43)
00:07:32.467832 IP 192.168.1.202.40425 > 192.168.1.1.53: 65414+ A? peoplestack-pa.clients6.google.com. (52)
00:07:42.844008 IP 192.168.1.202.39219 > 192.168.1.1.53: 30373+ A? alive.github.com. (34)
00:07:45.093229 IP 192.168.1.202.61670 > 192.168.1.1.53: 61313+ A? ssl.gstatic.com. (33)
00:08:05.645755 IP 192.168.1.202.43404 > 192.168.1.1.53: 2853+ A? slackb.com. (28)
00:08:13.176417 IP 192.168.1.202.61576 > 192.168.1.1.53: 5547+ A? signaler-pa.clients6.google.com. (49)
00:23:37.676830 IP 192.168.1.202.55479 > 192.168.1.1.53: 63213+ A? time.g.aaplimg.com. (36)
00:23:38.025372 IP 192.168.1.202.57569 > 192.168.1.1.53: 5929+ A? femetrics.grammarly.io. (40)
00:23:38.524906 IP 192.168.1.202.56648 > 192.168.1.1.53: 61631+ A? gateway.fe.apple-dns.net. (42)
00:23:38.846583 IP 192.168.1.202.26838 > 192.168.1.1.53: 30937+ A? chat.google.com. (33)
00:23:39.516261 IP 192.168.1.202.50263 > 192.168.1.1.53: 26860+ A? mesu.apple.com. (32)
00:23:40.533347 IP 192.168.1.202.62454 > 192.168.1.1.53: 17226+ A? wss-primary.slack.com. (39)
00:23:40.751127 IP 192.168.1.202.40080 > 192.168.1.1.53: 19363+ A? wss-primary.slack.com. (39)
00:23:41.153671 IP 192.168.1.202.31150 > 192.168.1.1.53: 22617+ A? probproofs.slack.com. (38)
00:23:41.592277 IP 192.168.1.202.34654 > 192.168.1.1.53: 26224+ A? edgeapi.slack.com. (35)
00:23:46.651261 IP 192.168.1.202.63736 > 192.168.1.1.53: 7540+ A? p47-contacts.icloud.com. (41)
00:23:47.536652 IP 192.168.1.202.64014 > 192.168.1.1.53: 8586+ A? guzzoni.apple.com. (35)
00:23:48.135312 IP 192.168.1.202.57807 > 192.168.1.1.53: 17189+ A? dns.weixin.qq.com.cn. (38)
00:23:57.826001 IP 192.168.1.202.63001 > 192.168.1.1.53: 63717+ A? d27xxe7juh1us6.cloudfront.net. (47)
00:24:05.683133 IP 192.168.1.202.11381 > 192.168.1.1.53: 47707+ A? peoplestack-pa.clients6.google.com. (52)
00:24:08.546368 IP 192.168.1.202.47052 > 192.168.1.1.53: 3765+ A? ssl.gstatic.com. (33)
00:24:10.829539 IP 192.168.1.202.9140 > 192.168.1.1.53: 57902+ A? treatment.grammarly.com. (41)
00:24:13.016087 IP 192.168.1.202.55706 > 192.168.1.1.53: 29919+ A? gateway.fe.apple-dns.net. (42)
00:24:17.084806 IP 192.168.1.202.39679 > 192.168.1.1.53: 16573+ A? play.google.com. (33)
00:41:02.662444 IP 192.168.1.202.60097 > 192.168.1.1.53: 33088+ A? time.g.aaplimg.com. (36)
00:41:02.859722 IP 192.168.1.202.61702 > 192.168.1.1.53: 46889+ A? c.apple.news. (30)
00:41:02.940069 IP 192.168.1.202.58929 > 192.168.1.1.53: 59968+ A? deault-exp-tas-com.e-0014.e-msedge.net. (56)
00:41:03.127012 IP 192.168.1.202.50593 > 192.168.1.1.53: 47976+ A? gateway.icloud.com. (36)
00:41:03.193614 IP 192.168.1.202.52913 > 192.168.1.1.53: 62893+ A? safebrowsing-proxy.g.aaplimg.com. (50)
00:41:03.213086 IP 192.168.1.202.49773 > 192.168.1.1.53: 49403+ A? cma.itunes.apple.com. (38)
00:41:04.146682 IP 192.168.1.202.64861 > 192.168.1.1.53: 9989+ A? swallow-apple-com.v.aaplimg.com. (49)
00:41:04.167092 IP 192.168.1.202.49570 > 192.168.1.1.53: 64777+ A? e10499.dsce9.akamaiedge.net. (45)
00:41:04.427642 IP 192.168.1.202.59327 > 192.168.1.1.53: 55656+ A? metrics.icloud.com. (36)
00:41:07.005242 IP 192.168.1.202.38092 > 192.168.1.1.53: 60235+ A? app.slack.com. (31)
00:41:22.841734 IP 192.168.1.202.9682 > 192.168.1.1.53: 35736+ A? alive.github.com. (34)
00:41:25.308425 IP 192.168.1.202.61918 > 192.168.1.1.53: 57135+ A? vortex.data.microsoft.com. (43)
00:41:26.382538 IP 192.168.1.202.54463 > 192.168.1.1.53: 54728+ A? www.googleapis.com. (36)
00:41:41.697231 IP 192.168.1.202.49637 > 192.168.1.1.53: 19079+ A? chat.google.com. (33)
00:41:50.865421 IP 192.168.1.202.30639 > 192.168.1.1.53: 2468+ A? ssl.gstatic.com. (33)
00:41:54.110177 IP 192.168.1.202.55832 > 192.168.1.1.53: 28175+ A? weather-data.apple.com. (40)
00:42:16.187377 IP 192.168.1.202.54645 > 192.168.1.1.53: 21353+ A? femetrics.grammarly.io. (40)
00:42:23.710846 IP 192.168.1.202.62022 > 192.168.1.1.53: 35156+ A? valid.apple.com. (33)
00:42:52.636149 IP 192.168.1.202.20064 > 192.168.1.1.53: 2004+ A? ssl.gstatic.com. (33)
00:43:02.409894 IP 192.168.1.202.62838 > 192.168.1.1.53: 49749+ A? e10499.dsce9.akamaiedge.net. (45)
00:43:02.438214 IP 192.168.1.202.55609 > 192.168.1.1.53: 1548+ A? gsp57-ssl-background.ls.apple.com. (51)
00:43:17.356938 IP 192.168.1.202.59517 > 192.168.1.1.53: 49199+ A? time.g.aaplimg.com. (36)
00:43:20.133143 IP 192.168.1.202.28499 > 192.168.1.1.53: 20105+ A? play.google.com. (33)
00:43:20.134327 IP 192.168.1.202.15714 > 192.168.1.1.53: 32431+ A? chat.google.com. (33)
00:43:31.366666 IP 192.168.1.202.54236 > 192.168.1.1.53: 46022+ A? gateway.fe.apple-dns.net. (42)
00:43:32.099784 IP 192.168.1.202.52729 > 192.168.1.1.53: 40866+ A? edge-088.usuyk1.icloud-content.com. (52)
00:43:32.575968 IP 192.168.1.202.62997 > 192.168.1.1.53: 29468+ A? p47-content.icloud.com. (40)
00:43:35.445691 IP 192.168.1.202.57742 > 192.168.1.1.53: 9251+ A? vortex.data.microsoft.com. (43)
00:44:10.226689 IP 192.168.1.202.51244 > 192.168.1.1.53: 64012+ A? gsp64-ssl.ls.apple.com. (40)
00:44:10.365653 IP 192.168.1.202.52854 > 192.168.1.1.53: 18741+ A? signaler-pa.clients6.google.com. (49)
00:44:26.583286 IP 192.168.1.202.63288 > 192.168.1.1.53: 5072+ A? femetrics.grammarly.io. (40)
00:48:31.142670 IP 192.168.1.202.32946 > 192.168.1.1.53: 40002+ A? chat.google.com. (33)
00:48:31.225385 IP 192.168.1.202.61201 > 192.168.1.1.53: 34714+ A? www.google.com. (32)
00:48:41.382200 IP 192.168.1.202.7306 > 192.168.1.1.53: 18987+ A? play.google.com. (33)
00:49:07.251874 IP 192.168.1.202.36902 > 192.168.1.1.53: 9939+ A? alive.github.com. (34)
00:49:08.622447 IP 192.168.1.202.51151 > 192.168.1.1.53: 20501+ A? wss-primary.slack.com. (39)
00:49:14.080064 IP 192.168.1.202.61514 > 192.168.1.1.53: 59448+ A? peoplestack-pa.clients6.google.com. (52)
00:49:15.413970 IP 192.168.1.202.58298 > 192.168.1.1.53: 3450+ A? treatment.grammarly.com. (41)
00:49:18.808640 IP 192.168.1.202.36154 > 192.168.1.1.53: 3327+ A? probproofs.slack.com. (38)
00:49:18.810024 IP 192.168.1.202.13901 > 192.168.1.1.53: 48867+ A? slackb.com. (28)
00:49:19.123586 IP 192.168.1.202.48910 > 192.168.1.1.53: 43274+ A? edgeapi.slack.com. (35)
00:49:29.929714 IP 192.168.1.202.54292 > 192.168.1.1.53: 51550+ A? vortex.data.microsoft.com. (43)
00:49:31.668139 IP 192.168.1.202.10262 > 192.168.1.1.53: 55950+ A? signaler-pa.clients6.google.com. (49)
00:49:35.571996 IP 192.168.1.202.56724 > 192.168.1.1.53: 21741+ A? gateway.fe.apple-dns.net. (42)
00:49:41.234744 IP 192.168.1.202.33059 > 192.168.1.1.53: 28596+ A? d27xxe7juh1us6.cloudfront.net. (47)
00:50:21.203035 IP 192.168.1.202.63685 > 192.168.1.1.53: 5257+ A? femetrics.grammarly.io. (40)
00:50:33.202667 IP 192.168.1.202.25115 > 192.168.1.1.53: 33865+ A? signaler-pa.clients6.google.com. (49)
00:50:55.978114 IP 192.168.1.202.44312 > 192.168.1.1.53: 22528+ A? ssl.gstatic.com. (33)
00:51:47.424044 IP 192.168.1.202.55329 > 192.168.1.1.53: 55523+ A? init.push.apple.com. (37)
00:52:12.086358 IP 192.168.1.202.45659 > 192.168.1.1.53: 12496+ A? ssl.gstatic.com. (33)
00:52:14.330282 IP 192.168.1.202.33256 > 192.168.1.1.53: 33066+ A? play.google.com. (33)
00:52:21.343671 IP 192.168.1.202.64581 > 192.168.1.1.53: 42808+ A? femetrics.grammarly.io. (40)
00:52:47.038973 IP 192.168.1.202.56326 > 192.168.1.1.53: 51288+ A? gateway.fe.apple-dns.net. (42)
00:52:47.407405 IP 192.168.1.202.65002 > 192.168.1.1.53: 18677+ A? me.apple-dns.net. (34)
00:52:47.444678 IP 192.168.1.202.62144 > 192.168.1.1.53: 36771+ A? edge-021.usqas5.icloud-content.com. (52)
00:52:47.465870 IP 192.168.1.202.63523 > 192.168.1.1.53: 10879+ A? edge-088.usuyk1.ce.apple-dns.net. (50)
00:52:47.499178 IP 192.168.1.202.55247 > 192.168.1.1.53: 57520+ A? edge-115.hkhkg.icloud-content.com. (51)
00:53:14.378324 IP 192.168.1.202.60327 > 192.168.1.1.53: 51121+ A? play.google.com. (33)
00:54:14.404355 IP 192.168.1.202.53062 > 192.168.1.1.53: 2210+ A? peoplestack-pa.clients6.google.com. (52)
00:54:14.410470 IP 192.168.1.202.60158 > 192.168.1.1.53: 60+ A? treatment.grammarly.com. (41)
00:54:21.333838 IP 192.168.1.202.55467 > 192.168.1.1.53: 3710+ A? femetrics.grammarly.io. (40)
00:54:30.800778 IP 192.168.1.202.22456 > 192.168.1.1.53: 64369+ A? clients4.google.com. (37)
00:54:38.556398 IP 192.168.1.202.15907 > 192.168.1.1.53: 16675+ A? signaler-pa.clients6.google.com. (49)
00:54:41.239502 IP 192.168.1.202.16745 > 192.168.1.1.53: 9135+ A? d27xxe7juh1us6.cloudfront.net. (47)
00:55:16.637253 IP 192.168.1.202.57033 > 192.168.1.1.53: 30784+ A? contacts.fe.apple-dns.net. (43)
00:55:17.721995 IP 192.168.1.202.57576 > 192.168.1.1.53: 7081+ A? guzzoni-apple-com.v.aaplimg.com. (49)
00:55:39.228176 IP 192.168.1.202.34868 > 192.168.1.1.53: 11546+ A? signaler-pa.clients6.google.com. (49)
00:55:50.188097 IP 192.168.1.202.28841 > 192.168.1.1.53: 713+ A? ssl.gstatic.com. (33)
00:56:07.437524 IP 192.168.1.202.54430 > 192.168.1.1.53: 41409+ A? gateway.fe.apple-dns.net. (42)
00:56:21.400373 IP 192.168.1.202.65033 > 192.168.1.1.53: 24055+ A? femetrics.grammarly.io. (40)
00:56:41.103055 IP 192.168.1.202.17140 > 192.168.1.1.53: 30227+ A? signaler-pa.clients6.google.com. (49)
00:56:52.516407 IP 192.168.1.202.48619 > 192.168.1.1.53: 64129+ A? ssl.gstatic.com. (33)
00:57:42.540662 IP 192.168.1.202.10929 > 192.168.1.1.53: 19193+ A? signaler-pa.clients6.google.com. (49)
00:58:05.959295 IP 192.168.1.202.57368 > 192.168.1.1.53: 56389+ A? bag.itunes.apple.com. (38)
00:58:06.128116 IP 192.168.1.202.58267 > 192.168.1.1.53: 57840+ A? cf.iadsdk.apple.com. (37)
00:58:06.157746 IP 192.168.1.202.55564 > 192.168.1.1.53: 58423+ A? mask.icloud.com. (33)
00:58:06.161719 IP 192.168.1.202.55380 > 192.168.1.1.53: 12026+ A? cdn-icloud-content.g.aaplimg.com. (50)
00:58:06.173367 IP 192.168.1.202.64655 > 192.168.1.1.53: 64045+ A? partiality.itunes.apple.com. (45)
00:58:06.259912 IP 192.168.1.202.57195 > 192.168.1.1.53: 41520+ A? ocsp2.apple.com. (33)
00:58:14.611127 IP 192.168.1.202.64243 > 192.168.1.1.53: 7475+ A? play.google.com. (33)
00:58:21.398403 IP 192.168.1.202.64137 > 192.168.1.1.53: 2933+ A? femetrics.grammarly.io. (40)
00:58:44.100011 IP 192.168.1.202.16097 > 192.168.1.1.53: 18498+ A? signaler-pa.clients6.google.com. (49)
00:59:15.409304 IP 192.168.1.202.64855 > 192.168.1.1.53: 9583+ A? treatment.grammarly.com. (41)
00:59:41.251642 IP 192.168.1.202.32049 > 192.168.1.1.53: 5329+ A? d27xxe7juh1us6.cloudfront.net. (47)
00:59:44.840009 IP 192.168.1.202.39337 > 192.168.1.1.53: 50637+ A? signaler-pa.clients6.google.com. (49)
01:00:21.402053 IP 192.168.1.202.57589 > 192.168.1.1.53: 57936+ A? femetrics.grammarly.io. (40)
01:00:38.364850 IP 192.168.1.202.18769 > 192.168.1.1.53: 55654+ A? ssl.gstatic.com. (33)
01:00:42.291756 IP 192.168.1.202.21407 > 192.168.1.1.53: 4798+ A? safebrowsing.googleapis.com. (45)
01:01:41.141949 IP 192.168.1.202.31258 > 192.168.1.1.53: 51204+ A? ssl.gstatic.com. (33)
01:02:14.972236 IP 192.168.1.202.41434 > 192.168.1.1.53: 47735+ A? play.google.com. (33)
01:02:21.385190 IP 192.168.1.202.57390 > 192.168.1.1.53: 30560+ A? femetrics.grammarly.io. (40)
01:02:42.986564 IP 192.168.1.202.6391 > 192.168.1.1.53: 22764+ A? ssl.gstatic.com. (33)
01:02:48.125764 IP 192.168.1.202.54913 > 192.168.1.1.53: 22120+ A? signaler-pa.clients6.google.com. (49)
01:03:45.052077 IP 192.168.1.202.22696 > 192.168.1.1.53: 64182+ A? ssl.gstatic.com. (33)
01:03:49.397784 IP 192.168.1.202.64248 > 192.168.1.1.53: 44279+ A? signaler-pa.clients6.google.com. (49)
01:04:21.359178 IP 192.168.1.202.52235 > 192.168.1.1.53: 9202+ A? femetrics.grammarly.io. (40)
01:04:41.272092 IP 192.168.1.202.42846 > 192.168.1.1.53: 574+ A? d27xxe7juh1us6.cloudfront.net. (47)
01:04:46.862832 IP 192.168.1.202.10671 > 192.168.1.1.53: 56931+ A? ssl.gstatic.com. (33)
01:06:21.358706 IP 192.168.1.202.60932 > 192.168.1.1.53: 53835+ A? femetrics.grammarly.io. (40)
01:06:53.579113 IP 192.168.1.202.51801 > 192.168.1.1.53: 64190+ A? signaler-pa.clients6.google.com. (49)
01:07:07.705080 IP 192.168.1.202.35109 > 192.168.1.1.53: 16115+ A? clientservices.googleapis.com. (47)
01:08:21.362427 IP 192.168.1.202.60406 > 192.168.1.1.53: 51625+ A? femetrics.grammarly.io. (40)
01:08:32.544618 IP 192.168.1.202.58000 > 192.168.1.1.53: 40950+ A? signaler-pa.clients6.google.com. (49)
01:08:37.366654 IP 192.168.1.202.65152 > 192.168.1.1.53: 23253+ A? api.apple-cloudkit.com. (40)
01:08:55.876943 IP 192.168.1.202.34598 > 192.168.1.1.53: 53540+ A? ssl.gstatic.com. (33)
01:09:15.316848 IP 192.168.1.202.16861 > 192.168.1.1.53: 46018+ A? safebrowsing.googleapis.com. (45)
01:09:15.406657 IP 192.168.1.202.51334 > 192.168.1.1.53: 65405+ A? treatment.grammarly.com. (41)
01:09:41.269405 IP 192.168.1.202.9786 > 192.168.1.1.53: 1870+ A? d27xxe7juh1us6.cloudfront.net. (47)
01:10:00.263925 IP 192.168.1.202.57315 > 192.168.1.1.53: 11568+ A? ssl.gstatic.com. (33)
01:10:21.373811 IP 192.168.1.202.54700 > 192.168.1.1.53: 61425+ A? femetrics.grammarly.io. (40)
01:10:50.977974 IP 192.168.1.202.62305 > 192.168.1.1.53: 2364+ A? gateway.fe.apple-dns.net. (42)
01:11:02.059842 IP 192.168.1.202.54256 > 192.168.1.1.53: 45661+ A? ssl.gstatic.com. (33)
01:11:02.927862 IP 192.168.1.202.53419 > 192.168.1.1.53: 16029+ A? deault-exp-tas-com.e-0014.e-msedge.net. (56)
01:11:34.968404 IP 192.168.1.202.7828 > 192.168.1.1.53: 29260+ A? signaler-pa.clients6.google.com. (49)
01:11:50.805681 IP 192.168.1.202.50039 > 192.168.1.1.53: 59974+ A? cdn-icloud-content.g.aaplimg.com. (50)
01:11:51.020830 IP 192.168.1.202.56893 > 192.168.1.1.53: 1924+ A? gateway.fe.apple-dns.net. (42)
01:12:00.116991 IP 192.168.1.202.55573 > 192.168.1.1.53: 60602+ A? token.safebrowsing.apple. (42)
01:12:00.236622 IP 192.168.1.202.61401 > 192.168.1.1.53: 58972+ A? safebrowsing-proxy.g.aaplimg.com. (50)
01:12:03.116286 IP 192.168.1.202.62505 > 192.168.1.1.53: 17149+ A? ssl.gstatic.com. (33)
01:12:15.628242 IP 192.168.1.202.19795 > 192.168.1.1.53: 35290+ A? addons-pa.clients6.google.com. (47)
01:12:21.339224 IP 192.168.1.202.63625 > 192.168.1.1.53: 25499+ A? femetrics.grammarly.io. (40)
01:12:36.405922 IP 192.168.1.202.37160 > 192.168.1.1.53: 4490+ A? signaler-pa.clients6.google.com. (49)
01:13:04.749784 IP 192.168.1.202.56730 > 192.168.1.1.53: 27098+ A? ssl.gstatic.com. (33)
01:14:10.523388 IP 192.168.1.202.38542 > 192.168.1.1.53: 30362+ A? ssl.gstatic.com. (33)
01:14:21.396186 IP 192.168.1.202.55251 > 192.168.1.1.53: 18492+ A? femetrics.grammarly.io. (40)
01:14:41.275322 IP 192.168.1.202.57845 > 192.168.1.1.53: 16473+ A? d27xxe7juh1us6.cloudfront.net. (47)
01:15:15.406961 IP 192.168.1.202.43555 > 192.168.1.1.53: 59315+ A? ssl.gstatic.com. (33)
01:16:21.374365 IP 192.168.1.202.62011 > 192.168.1.1.53: 34427+ A? femetrics.grammarly.io. (40)
01:16:41.866193 IP 192.168.1.202.7937 > 192.168.1.1.53: 44558+ A? signaler-pa.clients6.google.com. (49)
01:17:40.939299 IP 192.168.1.202.57071 > 192.168.1.1.53: 60938+ A? mesu-cdn.origin-apple.com.akadns.net. (54)
01:17:42.786409 IP 192.168.1.202.38437 > 192.168.1.1.53: 64597+ A? signaler-pa.clients6.google.com. (49)
01:17:42.793353 IP 192.168.1.202.57810 > 192.168.1.1.53: 28530+ A? mail.google.com. (33)
01:18:21.381201 IP 192.168.1.202.50238 > 192.168.1.1.53: 20095+ A? femetrics.grammarly.io. (40)
01:18:41.905088 IP 192.168.1.202.24639 > 192.168.1.1.53: 30926+ A? marketplace.visualstudio.com. (46)
01:18:44.849147 IP 192.168.1.202.54705 > 192.168.1.1.53: 45899+ A? signaler-pa.clients6.google.com. (49)
01:18:50.814286 IP 192.168.1.202.36522 > 192.168.1.1.53: 57091+ A? ssl.gstatic.com. (33)
01:19:15.403577 IP 192.168.1.202.53791 > 192.168.1.1.53: 54695+ A? treatment.grammarly.com. (41)
01:19:41.280995 IP 192.168.1.202.55564 > 192.168.1.1.53: 34642+ A? d27xxe7juh1us6.cloudfront.net. (47)
01:19:45.564567 IP 192.168.1.202.44470 > 192.168.1.1.53: 48583+ A? signaler-pa.clients6.google.com. (49)
01:20:21.392733 IP 192.168.1.202.49296 > 192.168.1.1.53: 59930+ A? femetrics.grammarly.io. (40)
01:22:18.529562 IP 192.168.1.202.58792 > 192.168.1.1.53: 34486+ A? time.apple.com. (32)
01:22:21.367797 IP 192.168.1.202.56740 > 192.168.1.1.53: 62667+ A? femetrics.grammarly.io. (40)
01:22:50.383718 IP 192.168.1.202.33032 > 192.168.1.1.53: 46030+ A? signaler-pa.clients6.google.com. (49)
01:22:56.341573 IP 192.168.1.202.61884 > 192.168.1.1.53: 53753+ A? mesu-cdn.origin-apple.com.akadns.net. (54)
01:22:56.367829 IP 192.168.1.202.51366 > 192.168.1.1.53: 35317+ A? e1329.g.akamaiedge.net. (40)
01:23:04.120343 IP 192.168.1.202.3993 > 192.168.1.1.53: 6301+ A? ssl.gstatic.com. (33)
01:23:07.522451 IP 192.168.1.202.11647 > 192.168.1.1.53: 30172+ A? alive.github.com. (34)
01:23:51.522360 IP 192.168.1.202.16677 > 192.168.1.1.53: 28104+ A? signaler-pa.clients6.google.com. (49)
01:24:06.008436 IP 192.168.1.202.6009 > 192.168.1.1.53: 60447+ A? ssl.gstatic.com. (33)
01:24:14.595806 IP 192.168.1.202.55624 > 192.168.1.1.53: 28206+ A? treatment.grammarly.com. (41)
01:24:21.378111 IP 192.168.1.202.50791 > 192.168.1.1.53: 35763+ A? femetrics.grammarly.io. (40)
01:24:41.280030 IP 192.168.1.202.31162 > 192.168.1.1.53: 12888+ A? d27xxe7juh1us6.cloudfront.net. (47)
01:25:14.307437 IP 192.168.1.202.59697 > 192.168.1.1.53: 27544+ A? peoplestack-pa.clients6.google.com. (52)
01:25:45.119384 IP 192.168.1.202.59820 > 192.168.1.1.53: 54928+ A? weather-data.apple.com. (40)
01:26:03.308557 IP 192.168.1.202.35217 > 192.168.1.1.53: 14422+ A? az764295.vo.msecnd.net. (40)
01:26:15.442145 IP 192.168.1.202.53082 > 192.168.1.1.53: 40935+ A? gateway.fe.apple-dns.net. (42)
01:26:21.339859 IP 192.168.1.202.54340 > 192.168.1.1.53: 23445+ A? femetrics.grammarly.io. (40)
01:26:39.086575 IP 192.168.1.202.39579 > 192.168.1.1.53: 59785+ A? signaler-pa.clients6.google.com. (49)
01:27:15.616466 IP 192.168.1.202.37674 > 192.168.1.1.53: 50343+ A? ssl.gstatic.com. (33)
01:27:40.685092 IP 192.168.1.202.45196 > 192.168.1.1.53: 54219+ A? signaler-pa.clients6.google.com. (49)
01:28:17.355535 IP 192.168.1.202.29229 > 192.168.1.1.53: 56735+ A? ssl.gstatic.com. (33)
01:28:21.366642 IP 192.168.1.202.58623 > 192.168.1.1.53: 52055+ A? femetrics.grammarly.io. (40)
01:29:15.386231 IP 192.168.1.202.65075 > 192.168.1.1.53: 41813+ A? treatment.grammarly.com. (41)
01:29:41.292891 IP 192.168.1.202.44773 > 192.168.1.1.53: 50841+ A? d27xxe7juh1us6.cloudfront.net. (47)
01:30:13.332862 IP 192.168.1.202.10236 > 192.168.1.1.53: 32715+ A? safebrowsing.googleapis.com. (45)
01:30:21.342036 IP 192.168.1.202.60630 > 192.168.1.1.53: 19321+ A? femetrics.grammarly.io. (40)
01:30:45.359761 IP 192.168.1.202.38057 > 192.168.1.1.53: 61011+ A? signaler-pa.clients6.google.com. (49)
01:31:46.241176 IP 192.168.1.202.54151 > 192.168.1.1.53: 13488+ A? signaler-pa.clients6.google.com. (49)
01:32:00.849165 IP 192.168.1.202.60484 > 192.168.1.1.53: 60313+ A? kt-prod.ess.apple.com. (39)
01:32:21.355637 IP 192.168.1.202.60305 > 192.168.1.1.53: 15838+ A? femetrics.grammarly.io. (40)
01:32:30.370144 IP 192.168.1.202.45485 > 192.168.1.1.53: 58867+ A? ssl.gstatic.com. (33)
01:33:34.043970 IP 192.168.1.202.9830 > 192.168.1.1.53: 21683+ A? ssl.gstatic.com. (33)
01:34:21.369649 IP 192.168.1.202.51563 > 192.168.1.1.53: 41253+ A? femetrics.grammarly.io. (40)
01:34:35.435636 IP 192.168.1.202.8511 > 192.168.1.1.53: 25338+ A? ssl.gstatic.com. (33)
01:34:41.312784 IP 192.168.1.202.35954 > 192.168.1.1.53: 48278+ A? d27xxe7juh1us6.cloudfront.net. (47)
01:35:01.762310 IP 192.168.1.202.54984 > 192.168.1.1.53: 59611+ A? gateway.fe.apple-dns.net. (42)
01:35:41.245958 IP 192.168.1.202.51595 > 192.168.1.1.53: 31256+ A? ssl.gstatic.com. (33)
01:35:51.997898 IP 192.168.1.202.49322 > 192.168.1.1.53: 58048+ A? signaler-pa.clients6.google.com. (49)
01:36:21.375688 IP 192.168.1.202.58080 > 192.168.1.1.53: 27179+ A? femetrics.grammarly.io. (40)
01:36:53.446507 IP 192.168.1.202.22576 > 192.168.1.1.53: 15883+ A? signaler-pa.clients6.google.com. (49)
01:37:07.686922 IP 192.168.1.202.12921 > 192.168.1.1.53: 63735+ A? clientservices.googleapis.com. (47)
01:38:17.708502 IP 192.168.1.202.48669 > 192.168.1.1.53: 31013+ A? ssl.gstatic.com. (33)
01:38:21.294384 IP 192.168.1.202.51858 > 192.168.1.1.53: 47261+ A? femetrics.grammarly.io. (40)
01:38:55.805743 IP 192.168.1.202.26672 > 192.168.1.1.53: 60857+ A? signaler-pa.clients6.google.com. (49)
01:39:15.380347 IP 192.168.1.202.49381 > 192.168.1.1.53: 34732+ A? treatment.grammarly.com. (41)
01:39:19.619424 IP 192.168.1.202.51236 > 192.168.1.1.53: 51990+ A? ssl.gstatic.com. (33)
01:39:41.311731 IP 192.168.1.202.55480 > 192.168.1.1.53: 39377+ A? d27xxe7juh1us6.cloudfront.net. (47)
01:39:57.654381 IP 192.168.1.202.57575 > 192.168.1.1.53: 40715+ A? signaler-pa.clients6.google.com. (49)
01:40:06.153022 IP 192.168.1.202.59330 > 192.168.1.1.53: 36236+ A? e673.dsce9.akamaiedge.net. (43)
01:40:21.346457 IP 192.168.1.202.58342 > 192.168.1.1.53: 11407+ A? femetrics.grammarly.io. (40)
01:40:23.266034 IP 192.168.1.202.38299 > 192.168.1.1.53: 50327+ A? ssl.gstatic.com. (33)
01:40:58.589400 IP 192.168.1.202.19473 > 192.168.1.1.53: 22970+ A? signaler-pa.clients6.google.com. (49)
01:41:02.902362 IP 192.168.1.202.49712 > 192.168.1.1.53: 9149+ A? default.exp-tas.com. (37)
01:41:06.978557 IP 192.168.1.202.14253 > 192.168.1.1.53: 17992+ A? app.slack.com. (31)
01:41:12.559468 IP 192.168.1.202.53388 > 192.168.1.1.53: 4056+ A? gateway.fe.apple-dns.net. (42)
01:41:14.778997 IP 192.168.1.202.50220 > 192.168.1.1.53: 40562+ A? addons-pa.clients6.google.com. (47)
01:42:00.083784 IP 192.168.1.202.20369 > 192.168.1.1.53: 20873+ A? signaler-pa.clients6.google.com. (49)
01:42:20.824730 IP 192.168.1.202.60528 > 192.168.1.1.53: 23134+ A? proxy.safebrowsing.apple. (42)
01:42:21.329562 IP 192.168.1.202.57465 > 192.168.1.1.53: 42750+ A? femetrics.grammarly.io. (40)
01:42:59.943297 IP 192.168.1.202.30685 > 192.168.1.1.53: 56133+ A? ssl.gstatic.com. (33)
01:43:01.620681 IP 192.168.1.202.64237 > 192.168.1.1.53: 51044+ A? signaler-pa.clients6.google.com. (49)
01:44:01.514784 IP 192.168.1.202.34418 > 192.168.1.1.53: 31747+ A? ssl.gstatic.com. (33)
01:44:21.346921 IP 192.168.1.202.62736 > 192.168.1.1.53: 10953+ A? femetrics.grammarly.io. (40)
01:44:41.323021 IP 192.168.1.202.16813 > 192.168.1.1.53: 65105+ A? d27xxe7juh1us6.cloudfront.net. (47)
01:45:04.425848 IP 192.168.1.202.65062 > 192.168.1.1.53: 605+ A? cdn-icloud-content.g.aaplimg.com. (50)
01:45:04.591388 IP 192.168.1.202.52189 > 192.168.1.1.53: 46179+ A? gateway.fe.apple-dns.net. (42)
01:45:36.258301 IP 192.168.1.202.10389 > 192.168.1.1.53: 10578+ A? ssl.gstatic.com. (33)
01:45:59.432847 IP 192.168.1.202.44106 > 192.168.1.1.53: 9155+ A? signaler-pa.clients6.google.com. (49)
01:46:21.358343 IP 192.168.1.202.59130 > 192.168.1.1.53: 55571+ A? femetrics.grammarly.io. (40)
01:46:37.479989 IP 192.168.1.202.5587 > 192.168.1.1.53: 42625+ A? ssl.gstatic.com. (33)
01:47:00.570691 IP 192.168.1.202.30909 > 192.168.1.1.53: 14631+ A? signaler-pa.clients6.google.com. (49)
01:47:40.907006 IP 192.168.1.202.20467 > 192.168.1.1.53: 53621+ A? ssl.gstatic.com. (33)
01:48:21.365178 IP 192.168.1.202.57556 > 192.168.1.1.53: 30139+ A? femetrics.grammarly.io. (40)
02:04:10.603218 IP 192.168.1.202.62658 > 192.168.1.1.53: 61134+ A? time.g.aaplimg.com. (36)
02:04:10.799179 IP 192.168.1.202.59583 > 192.168.1.1.53: 25036+ A? weather-data.apple.com. (40)
02:04:11.228050 IP 192.168.1.202.64289 > 192.168.1.1.53: 26649+ A? gateway.icloud.com. (36)
02:04:11.334982 IP 192.168.1.202.54839 > 192.168.1.1.53: 19774+ A? swallow.apple.com. (35)
02:04:11.338258 IP 192.168.1.202.51670 > 192.168.1.1.53: 1077+ A? configuration.ls.apple.com. (44)
02:04:13.614406 IP 192.168.1.202.16362 > 192.168.1.1.53: 15783+ A? wss-primary.slack.com. (39)
02:04:13.775402 IP 192.168.1.202.33627 > 192.168.1.1.53: 4306+ A? probproofs.slack.com. (38)
02:04:14.109285 IP 192.168.1.202.55702 > 192.168.1.1.53: 23239+ A? edgeapi.slack.com. (35)
02:04:19.561100 IP 192.168.1.202.11613 > 192.168.1.1.53: 42951+ A? chat.google.com. (33)
02:04:21.798899 IP 192.168.1.202.8866 > 192.168.1.1.53: 1848+ A? alive.github.com. (34)
02:04:33.811933 IP 192.168.1.202.50628 > 192.168.1.1.53: 28179+ A? play.google.com. (33)
02:04:37.331298 IP 192.168.1.202.61738 > 192.168.1.1.53: 4504+ A? treatment.grammarly.com. (41)
02:04:38.701357 IP 192.168.1.202.43987 > 192.168.1.1.53: 60623+ A? ssl.gstatic.com. (33)
02:04:42.817941 IP 192.168.1.202.57115 > 192.168.1.1.53: 18003+ A? p47-caldav.icloud.com. (39)
02:04:42.860202 IP 192.168.1.202.55972 > 192.168.1.1.53: 46126+ A? gateway.fe.apple-dns.net. (42)
02:04:53.598464 IP 192.168.1.202.54074 > 192.168.1.1.53: 36659+ A? vortex.data.microsoft.com. (43)
02:04:54.403327 IP 192.168.1.202.33878 > 192.168.1.1.53: 12023+ A? peoplestack-pa.clients6.google.com. (52)
02:05:03.291066 IP 192.168.1.202.2158 > 192.168.1.1.53: 50605+ A? d27xxe7juh1us6.cloudfront.net. (47)
02:05:06.307170 IP 192.168.1.202.14318 > 192.168.1.1.53: 43104+ A? treatment.grammarly.com. (41)
02:15:31.481422 IP 192.168.1.202.50092 > 192.168.1.1.53: 29550+ A? time.g.aaplimg.com. (36)
02:15:31.680648 IP 192.168.1.202.62387 > 192.168.1.1.53: 49104+ A? c.apple.news. (30)
02:15:31.948424 IP 192.168.1.202.61800 > 192.168.1.1.53: 17985+ A? deault-exp-tas-com.e-0014.e-msedge.net. (56)
02:15:31.949943 IP 192.168.1.202.56996 > 192.168.1.1.53: 56894+ A? safebrowsing-proxy.g.aaplimg.com. (50)
02:15:31.965805 IP 192.168.1.202.57819 > 192.168.1.1.53: 43539+ A? gateway.fe.apple-dns.net. (42)
02:15:32.555285 IP 192.168.1.202.60739 > 192.168.1.1.53: 45073+ A? wss-primary.slack.com. (39)
02:15:32.753454 IP 192.168.1.202.53352 > 192.168.1.1.53: 44611+ A? probproofs.slack.com. (38)
02:15:32.753785 IP 192.168.1.202.21031 > 192.168.1.1.53: 49427+ A? slackb.com. (28)
02:15:33.042751 IP 192.168.1.202.33995 > 192.168.1.1.53: 33246+ A? edgeapi.slack.com. (35)
02:15:40.436924 IP 192.168.1.202.53271 > 192.168.1.1.53: 42017+ A? p47-contacts.icloud.com. (41)
02:15:41.280839 IP 192.168.1.202.50213 > 192.168.1.1.53: 10623+ A? guzzoni.apple.com. (35)
02:15:42.163050 IP 192.168.1.202.25102 > 192.168.1.1.53: 26424+ A? mtalk.google.com. (34)
02:15:57.630619 IP 192.168.1.202.43373 > 192.168.1.1.53: 712+ A? ssl.gstatic.com. (33)
02:16:01.412792 IP 192.168.1.202.55133 > 192.168.1.1.53: 30852+ A? femetrics.grammarly.io. (40)
02:16:11.670366 IP 192.168.1.202.57693 > 192.168.1.1.53: 59634+ A? alive.github.com. (34)
02:16:13.135110 IP 192.168.1.202.33831 > 192.168.1.1.53: 16898+ A? peoplestack-pa.clients6.google.com. (52)
02:16:13.460834 IP 192.168.1.202.56752 > 192.168.1.1.53: 36913+ A? vortex.data.microsoft.com. (43)
02:16:23.561793 IP 192.168.1.202.3365 > 192.168.1.1.53: 28974+ A? play.google.com. (33)
02:16:33.525271 IP 192.168.1.202.37580 > 192.168.1.1.53: 51776+ A? signaler-pa.clients6.google.com. (49)
02:16:59.430982 IP 192.168.1.202.33567 > 192.168.1.1.53: 30203+ A? ssl.gstatic.com. (33)
02:17:35.389768 IP 192.168.1.202.40799 > 192.168.1.1.53: 29708+ A? signaler-pa.clients6.google.com. (49)
02:17:59.081026 IP 192.168.1.202.57703 > 192.168.1.1.53: 45901+ A? gspe35-ssl.ls.apple.com. (41)
02:18:01.329685 IP 192.168.1.202.62415 > 192.168.1.1.53: 56849+ A? femetrics.grammarly.io. (40)
02:18:06.563112 IP 192.168.1.202.29275 > 192.168.1.1.53: 36501+ A? play.google.com. (33)
02:18:32.445778 IP 192.168.1.202.8768 > 192.168.1.1.53: 34265+ A? ssl.gstatic.com. (33)
02:18:55.422980 IP 192.168.1.202.58995 > 192.168.1.1.53: 21038+ A? gsp64-ssl.ls.apple.com. (40)
02:19:25.682637 IP 192.168.1.202.63606 > 192.168.1.1.53: 64924+ A? gateway.fe.apple-dns.net. (42)
02:19:36.739272 IP 192.168.1.202.30570 > 192.168.1.1.53: 39710+ A? ssl.gstatic.com. (33)
02:19:55.530131 IP 192.168.1.202.49207 > 192.168.1.1.53: 51628+ A? play.google.com. (33)
02:20:01.403727 IP 192.168.1.202.65502 > 192.168.1.1.53: 53972+ A? femetrics.grammarly.io. (40)
02:20:21.383261 IP 192.168.1.202.52565 > 192.168.1.1.53: 40396+ A? d27xxe7juh1us6.cloudfront.net. (47)
02:20:37.866791 IP 192.168.1.202.57236 > 192.168.1.1.53: 2193+ A? signaler-pa.clients6.google.com. (49)
02:20:39.120703 IP 192.168.1.202.47800 > 192.168.1.1.53: 6709+ A? ssl.gstatic.com. (33)
02:20:55.470981 IP 192.168.1.202.20554 > 192.168.1.1.53: 57342+ A? peoplestack-pa.clients6.google.com. (52)
02:21:08.111912 IP 192.168.1.202.19102 > 192.168.1.1.53: 31096+ A? play.google.com. (33)
02:21:39.101795 IP 192.168.1.202.29964 > 192.168.1.1.53: 52932+ A? signaler-pa.clients6.google.com. (49)
02:21:39.950009 IP 192.168.1.202.49502 > 192.168.1.1.53: 11433+ A? ssl.gstatic.com. (33)
02:22:01.378159 IP 192.168.1.202.59892 > 192.168.1.1.53: 18164+ A? femetrics.grammarly.io. (40)
02:22:42.876041 IP 192.168.1.202.48667 > 192.168.1.1.53: 52311+ A? ssl.gstatic.com. (33)
02:22:54.729515 IP 192.168.1.202.14904 > 192.168.1.1.53: 32554+ A? play.google.com. (33)
02:24:01.376706 IP 192.168.1.202.51971 > 192.168.1.1.53: 15009+ A? femetrics.grammarly.io. (40)
02:24:54.445896 IP 192.168.1.202.18593 > 192.168.1.1.53: 28099+ A? play.google.com. (33)
02:24:55.420763 IP 192.168.1.202.50180 > 192.168.1.1.53: 12957+ A? treatment.grammarly.com. (41)
02:25:21.394062 IP 192.168.1.202.56453 > 192.168.1.1.53: 34426+ A? d27xxe7juh1us6.cloudfront.net. (47)
02:25:43.017306 IP 192.168.1.202.19893 > 192.168.1.1.53: 49048+ A? signaler-pa.clients6.google.com. (49)
02:25:54.827346 IP 192.168.1.202.63651 > 192.168.1.1.53: 18992+ A? play.google.com. (33)
02:26:01.308526 IP 192.168.1.202.62004 > 192.168.1.1.53: 63497+ A? femetrics.grammarly.io. (40)
02:26:02.425456 IP 192.168.1.202.19103 > 192.168.1.1.53: 36712+ A? safebrowsing.googleapis.com. (45)
02:26:20.652120 IP 192.168.1.202.55567 > 192.168.1.1.53: 47706+ A? ssl.gstatic.com. (33)
02:26:44.363916 IP 192.168.1.202.56644 > 192.168.1.1.53: 1107+ A? signaler-pa.clients6.google.com. (49)
02:26:53.942478 IP 192.168.1.202.55610 > 192.168.1.1.53: 42787+ A? az764295.vo.msecnd.net. (40)
02:27:21.812996 IP 192.168.1.202.55812 > 192.168.1.1.53: 65095+ A? ssl.gstatic.com. (33)
02:28:01.307174 IP 192.168.1.202.63672 > 192.168.1.1.53: 42334+ A? femetrics.grammarly.io. (40)
02:28:23.098184 IP 192.168.1.202.18359 > 192.168.1.1.53: 26260+ A? ssl.gstatic.com. (33)
02:29:47.573193 IP 192.168.1.202.51974 > 192.168.1.1.53: 5999+ A? signaler-pa.clients6.google.com. (49)
02:30:01.373056 IP 192.168.1.202.50601 > 192.168.1.1.53: 27561+ A? femetrics.grammarly.io. (40)
02:30:06.590220 IP 192.168.1.202.58143 > 192.168.1.1.53: 45489+ A? probproofs.slack.com. (38)
02:30:21.403258 IP 192.168.1.202.28705 > 192.168.1.1.53: 2614+ A? d27xxe7juh1us6.cloudfront.net. (47)
02:30:28.798008 IP 192.168.1.202.12169 > 192.168.1.1.53: 60394+ A? ssl.gstatic.com. (33)
02:30:48.690430 IP 192.168.1.202.60213 > 192.168.1.1.53: 53883+ A? signaler-pa.clients6.google.com. (49)
02:30:55.138590 IP 192.168.1.202.48994 > 192.168.1.1.53: 17169+ A? play.google.com. (33)
02:31:31.895020 IP 192.168.1.202.17846 > 192.168.1.1.53: 28829+ A? ssl.gstatic.com. (33)
02:31:40.743817 IP 192.168.1.202.11426 > 192.168.1.1.53: 353+ A? clients2.google.com. (37)
02:31:40.745551 IP 192.168.1.202.65060 > 192.168.1.1.53: 22099+ A? update.googleapis.com. (39)
02:31:40.861845 IP 192.168.1.202.54023 > 192.168.1.1.53: 61071+ A? clients2.googleusercontent.com. (48)
02:31:42.095319 IP 192.168.1.202.18586 > 192.168.1.1.53: 48043+ A? clients4.google.com. (37)
02:31:42.131429 IP 192.168.1.202.21845 > 192.168.1.1.53: 40034+ A? watchtower.1password.com. (42)
02:31:55.167303 IP 192.168.1.202.1737 > 192.168.1.1.53: 50449+ A? play.google.com. (33)
02:32:01.355290 IP 192.168.1.202.60504 > 192.168.1.1.53: 7605+ A? femetrics.grammarly.io. (40)
02:32:12.062267 IP 192.168.1.202.20765 > 192.168.1.1.53: 33282+ A? auth.grammarly.com. (36)
02:32:12.171364 IP 192.168.1.202.6286 > 192.168.1.1.53: 64626+ A? treatment.grammarly.com. (41)
02:32:12.284203 IP 192.168.1.202.25339 > 192.168.1.1.53: 50954+ A? data.grammarly.com. (36)
02:32:46.011993 IP 192.168.1.202.53774 > 192.168.1.1.53: 36940+ A? gateway.fe.apple-dns.net. (42)
02:32:47.733624 IP 192.168.1.202.12680 > 192.168.1.1.53: 56112+ A? clientservices.googleapis.com. (47)
02:34:01.187132 IP 192.168.1.202.49451 > 192.168.1.1.53: 51267+ A? femetrics.grammarly.io. (40)
02:34:54.246921 IP 192.168.1.202.7392 > 192.168.1.1.53: 28494+ A? signaler-pa.clients6.google.com. (49)
02:34:55.420370 IP 192.168.1.202.59552 > 192.168.1.1.53: 13693+ A? treatment.grammarly.com. (41)
02:35:00.796867 IP 192.168.1.202.59005 > 192.168.1.1.53: 47459+ A? gateway.fe.apple-dns.net. (42)
02:35:21.414069 IP 192.168.1.202.32998 > 192.168.1.1.53: 25171+ A? d27xxe7juh1us6.cloudfront.net. (47)
02:35:25.449490 IP 192.168.1.202.64678 > 192.168.1.1.53: 21341+ A? tools.google.com. (34)
02:35:25.523008 IP 192.168.1.202.64156 > 192.168.1.1.53: 35845+ A? ocsp.pki.goog. (31)
02:35:32.825147 IP 192.168.1.202.62007 > 192.168.1.1.53: 1527+ A? api.smoot.apple.com. (37)
02:35:33.695242 IP 192.168.1.202.50010 > 192.168.1.1.53: 16686+ A? ocsp2.apple.com. (33)
02:35:44.156012 IP 192.168.1.202.58711 > 192.168.1.1.53: 27935+ A? init.itunes.apple.com. (39)
02:35:45.411948 IP 192.168.1.202.14253 > 192.168.1.1.53: 13059+ A? ssl.gstatic.com. (33)
02:35:55.011316 IP 192.168.1.202.51072 > 192.168.1.1.53: 16867+ A? addons-pa.clients6.google.com. (47)
02:36:01.269282 IP 192.168.1.202.52054 > 192.168.1.1.53: 53660+ A? femetrics.grammarly.io. (40)
02:36:01.733220 IP 192.168.1.202.23985 > 192.168.1.1.53: 3061+ A? signaler-pa.clients6.google.com. (49)
02:36:06.015765 IP 192.168.1.202.19555 > 192.168.1.1.53: 8277+ A? play.google.com. (33)
02:36:48.138112 IP 192.168.1.202.60152 > 192.168.1.1.53: 55840+ A? ssl.gstatic.com. (33)
02:37:04.188712 IP 192.168.1.202.26195 > 192.168.1.1.53: 7528+ A? signaler-pa.clients6.google.com. (49)
02:37:55.849560 IP 192.168.1.202.19462 > 192.168.1.1.53: 25691+ A? play.google.com. (33)
02:38:01.413987 IP 192.168.1.202.62278 > 192.168.1.1.53: 53366+ A? femetrics.grammarly.io. (40)
02:38:06.750724 IP 192.168.1.202.45700 > 192.168.1.1.53: 18865+ A? signaler-pa.clients6.google.com. (49)
02:39:53.755357 IP 192.168.1.202.41422 > 192.168.1.1.53: 55770+ A? ssl.gstatic.com. (33)
02:40:01.317898 IP 192.168.1.202.56238 > 192.168.1.1.53: 13634+ A? femetrics.grammarly.io. (40)
02:40:21.412974 IP 192.168.1.202.45179 > 192.168.1.1.53: 62371+ A? d27xxe7juh1us6.cloudfront.net. (47)
02:40:54.979855 IP 192.168.1.202.27530 > 192.168.1.1.53: 19819+ A? ssl.gstatic.com. (33)
02:41:06.990709 IP 192.168.1.202.9167 > 192.168.1.1.53: 63620+ A? app.slack.com. (31)
02:41:10.213727 IP 192.168.1.202.57062 > 192.168.1.1.53: 20332+ A? signaler-pa.clients6.google.com. (49)
02:41:54.475799 IP 192.168.1.202.23883 > 192.168.1.1.53: 1606+ A? play.google.com. (33)
02:42:01.385733 IP 192.168.1.202.49565 > 192.168.1.1.53: 42548+ A? femetrics.grammarly.io. (40)
02:42:11.689164 IP 192.168.1.202.6386 > 192.168.1.1.53: 58627+ A? signaler-pa.clients6.google.com. (49)
02:43:12.829996 IP 192.168.1.202.26721 > 192.168.1.1.53: 49495+ A? signaler-pa.clients6.google.com. (49)
02:43:24.289774 IP 192.168.1.202.1889 > 192.168.1.1.53: 8129+ A? mail.google.com. (33)
02:43:54.349928 IP 192.168.1.202.47548 > 192.168.1.1.53: 27014+ A? play.google.com. (33)
02:44:01.301412 IP 192.168.1.202.60060 > 192.168.1.1.53: 31196+ A? femetrics.grammarly.io. (40)
02:44:13.539535 IP 192.168.1.202.10901 > 192.168.1.1.53: 42696+ A? signaler-pa.clients6.google.com. (49)
02:44:32.151566 IP 192.168.1.202.60722 > 192.168.1.1.53: 19593+ A? weather-data.apple.com. (40)
02:44:37.403481 IP 192.168.1.202.49413 > 192.168.1.1.53: 36047+ A? cma.itunes.apple.com. (38)
02:44:55.414991 IP 192.168.1.202.64829 > 192.168.1.1.53: 2306+ A? treatment.grammarly.com. (41)
02:45:05.800934 IP 192.168.1.202.59377 > 192.168.1.1.53: 49390+ A? ssl.gstatic.com. (33)
02:45:21.426350 IP 192.168.1.202.37530 > 192.168.1.1.53: 10934+ A? d27xxe7juh1us6.cloudfront.net. (47)
02:45:31.855909 IP 192.168.1.202.53245 > 192.168.1.1.53: 41803+ A? deault-exp-tas-com.e-0014.e-msedge.net. (56)
02:45:43.176828 IP 192.168.1.202.49171 > 192.168.1.1.53: 26030+ A? safebrowsing-proxy.g.aaplimg.com. (50)
02:46:01.365603 IP 192.168.1.202.54442 > 192.168.1.1.53: 48767+ A? femetrics.grammarly.io. (40)
02:46:09.346020 IP 192.168.1.202.26793 > 192.168.1.1.53: 43699+ A? ssl.gstatic.com. (33)
02:46:16.018327 IP 192.168.1.202.4433 > 192.168.1.1.53: 22673+ A? signaler-pa.clients6.google.com. (49)
02:47:17.055530 IP 192.168.1.202.5533 > 192.168.1.1.53: 47996+ A? signaler-pa.clients6.google.com. (49)
02:47:37.364401 IP 192.168.1.202.33599 > 192.168.1.1.53: 12729+ A? clients4.google.com. (37)
02:47:45.917379 IP 192.168.1.202.57157 > 192.168.1.1.53: 12053+ A? time.apple.com. (32)
02:47:54.628493 IP 192.168.1.202.63541 > 192.168.1.1.53: 24716+ A? play.google.com. (33)
02:48:01.388927 IP 192.168.1.202.59964 > 192.168.1.1.53: 61535+ A? femetrics.grammarly.io. (40)
02:48:14.415846 IP 192.168.1.202.42059 > 192.168.1.1.53: 32988+ A? peoplestackwebexperiments-pa.clients6.google.com. (66)
02:49:21.149043 IP 192.168.1.202.63337 > 192.168.1.1.53: 38086+ A? signaler-pa.clients6.google.com. (49)
02:49:46.864382 IP 192.168.1.202.20972 > 192.168.1.1.53: 9993+ A? ssl.gstatic.com. (33)
02:50:00.892287 IP 192.168.1.202.62215 > 192.168.1.1.53: 29242+ A? gateway.fe.apple-dns.net. (42)
02:50:01.236056 IP 192.168.1.202.62117 > 192.168.1.1.53: 63638+ A? femetrics.grammarly.io. (40)
02:50:21.432858 IP 192.168.1.202.10274 > 192.168.1.1.53: 7013+ A? d27xxe7juh1us6.cloudfront.net. (47)
02:50:22.590535 IP 192.168.1.202.38169 > 192.168.1.1.53: 56739+ A? signaler-pa.clients6.google.com. (49)
02:50:38.083120 IP 192.168.1.202.59430 > 192.168.1.1.53: 35575+ A? cdn-icloud-content.g.aaplimg.com. (50)
02:50:38.247672 IP 192.168.1.202.59416 > 192.168.1.1.53: 24351+ A? gateway.fe.apple-dns.net. (42)
02:50:48.852929 IP 192.168.1.202.12432 > 192.168.1.1.53: 40683+ A? ssl.gstatic.com. (33)
02:51:11.928443 IP 192.168.1.202.26443 > 192.168.1.1.53: 37446+ A? alive.github.com. (34)
02:51:45.663815 IP 192.168.1.202.36824 > 192.168.1.1.53: 64722+ A? marketplace.visualstudio.com. (46)
02:51:54.727803 IP 192.168.1.202.29993 > 192.168.1.1.53: 19930+ A? peoplestack-pa.clients6.google.com. (52)
02:52:01.363710 IP 192.168.1.202.56868 > 192.168.1.1.53: 37641+ A? femetrics.grammarly.io. (40)
02:52:05.649942 IP 192.168.1.202.18404 > 192.168.1.1.53: 8373+ A? play.google.com. (33)
02:53:52.823620 IP 192.168.1.202.58688 > 192.168.1.1.53: 51980+ A? signaler-pa.clients6.google.com. (49)
02:53:54.893646 IP 192.168.1.202.45273 > 192.168.1.1.53: 34145+ A? safebrowsing.googleapis.com. (45)
02:53:54.894202 IP 192.168.1.202.40705 > 192.168.1.1.53: 59417+ A? play.google.com. (33)
02:54:01.384682 IP 192.168.1.202.64269 > 192.168.1.1.53: 46230+ A? femetrics.grammarly.io. (40)
02:54:05.113806 IP 192.168.1.202.31438 > 192.168.1.1.53: 55369+ A? ssl.gstatic.com. (33)
